parent_paper_title,parent_arxiv_link,citation_shorthand,raw_citation_text,cited_paper_title,cited_paper_arxiv_link,cited_paper_abstract,bib_paper_authors,bib_paper_year,bib_paper_month,bib_paper_url,bib_paper_doi,bib_paper_journal
Fine-Tuning LLMs to Analyze Multiple Dimensions of Code Review: A Maximum Entropy Regulated Long Chain-of-Thought Approach,http://arxiv.org/abs/2509.21170v1,haarnoja2017reinforcement,\cite{haarnoja2017reinforcement},Reinforcement Learning with Deep Energy-Based Policies,http://arxiv.org/abs/1702.08165v2,"We propose a method for learning expressive energy-based policies for
continuous states and actions, which has been feasible only in tabular domains
before. We apply our method to learning maximum entropy policies, resulting
into a new algorithm, called soft Q-learning, that expresses the optimal policy
via a Boltzmann distribution. We use the recently proposed amortized Stein
variational gradient descent to learn a stochastic sampling network that
approximates samples from this distribution. The benefits of the proposed
algorithm include improved exploration and compositionality that allows
transferring skills between tasks, which we confirm in simulated experiments
with swimming and walking robots. We also draw a connection to actor-critic
methods, which can be viewed performing approximate inference on the
corresponding energy-based model.","Haarnoja, Tuomas and Tang, Haoran and Abbeel, Pieter and Levine, Sergey",2017,,,,
Fine-Tuning LLMs to Analyze Multiple Dimensions of Code Review: A Maximum Entropy Regulated Long Chain-of-Thought Approach,http://arxiv.org/abs/2509.21170v1,schulman2017equivalence,\cite{schulman2017equivalence},Equivalence Between Policy Gradients and Soft Q-Learning,http://arxiv.org/abs/1704.06440v4,"Two of the leading approaches for model-free reinforcement learning are
policy gradient methods and $Q$-learning methods. $Q$-learning methods can be
effective and sample-efficient when they work, however, it is not
well-understood why they work, since empirically, the $Q$-values they estimate
are very inaccurate. A partial explanation may be that $Q$-learning methods are
secretly implementing policy gradient updates: we show that there is a precise
equivalence between $Q$-learning and policy gradient methods in the setting of
entropy-regularized reinforcement learning, that ""soft"" (entropy-regularized)
$Q$-learning is exactly equivalent to a policy gradient method. We also point
out a connection between $Q$-learning methods and natural policy gradient
methods. Experimentally, we explore the entropy-regularized versions of
$Q$-learning and policy gradients, and we find them to perform as well as (or
slightly better than) the standard variants on the Atari benchmark. We also
show that the equivalence holds in practical settings by constructing a
$Q$-learning method that closely matches the learning dynamics of A3C without
using a target network or $\epsilon$-greedy exploration schedule.","Schulman, John and Chen, Xi and Abbeel, Pieter",2017,,,,arXiv preprint arXiv:1704.06440
Fine-Tuning LLMs to Analyze Multiple Dimensions of Code Review: A Maximum Entropy Regulated Long Chain-of-Thought Approach,http://arxiv.org/abs/2509.21170v1,haarnoja2018soft,\cite{haarnoja2018soft},Soft actor-critic: Off-policy maximum entropy deep reinforcement learning with a stochastic actor,,,"Haarnoja, Tuomas and Zhou, Aurick and Abbeel, Pieter and Levine, Sergey",2018,,,,
Fine-Tuning LLMs to Analyze Multiple Dimensions of Code Review: A Maximum Entropy Regulated Long Chain-of-Thought Approach,http://arxiv.org/abs/2509.21170v1,jaynes1957information,\cite{jaynes1957information},Information Theory and Statistical Mechanics Revisited,http://arxiv.org/abs/1105.5662v1,"The statistical mechanics of Gibbs is a juxtaposition of subjective,
probabilistic ideas on the one hand and objective, mechanical ideas on the
other. In this paper, we follow the path set out by Jaynes, including elements
added subsequently to that original work, to explore the consequences of the
purely statistical point of view. We show how standard methods in the
equilibrium theory could have been derived simply from a description of the
available problem information. In addition, our presentation leads to novel
insights into questions associated with symmetry and non-equilibrium
statistical mechanics. Two surprising consequences to be explored in further
work are that (in)distinguishability factors are automatically predicted from
the problem formulation and that a quantity related to the thermodynamic
entropy production is found by considering information loss in non-equilibrium
processes. Using the problem of ion channel thermodynamics as an example, we
illustrate the idea of building up complexity by successively adding
information to create progressively more complex descriptions of a physical
system. Our result is that such statistical mechanical descriptions can be used
to create transparent, computable, experimentally-relevant models that may be
informed by more detailed atomistic simulations. We also derive a theory for
the kinetic behavior of this system, identifying the nonequilibrium `process'
free energy functional. The Gibbs relation for this functional is a
fluctuation-dissipation theorem applicable arbitrarily far from equilibrium,
that captures the effect of non-local and time-dependent behavior from
transient driving forces. Based on this work, it is clear that statistical
mechanics is a general tool for constructing the relationships between
constraints on system information.","Jaynes, Edwin T",1957,,,,Physical review
Fine-Tuning LLMs to Analyze Multiple Dimensions of Code Review: A Maximum Entropy Regulated Long Chain-of-Thought Approach,http://arxiv.org/abs/2509.21170v1,levine2018reinforcement,\cite{levine2018reinforcement},"Reinforcement Learning and Control as Probabilistic Inference: Tutorial
  and Review",http://arxiv.org/abs/1805.00909v3,"The framework of reinforcement learning or optimal control provides a
mathematical formalization of intelligent decision making that is powerful and
broadly applicable. While the general form of the reinforcement learning
problem enables effective reasoning about uncertainty, the connection between
reinforcement learning and inference in probabilistic models is not immediately
obvious. However, such a connection has considerable value when it comes to
algorithm design: formalizing a problem as probabilistic inference in principle
allows us to bring to bear a wide array of approximate inference tools, extend
the model in flexible and powerful ways, and reason about compositionality and
partial observability. In this article, we will discuss how a generalization of
the reinforcement learning or optimal control problem, which is sometimes
termed maximum entropy reinforcement learning, is equivalent to exact
probabilistic inference in the case of deterministic dynamics, and variational
inference in the case of stochastic dynamics. We will present a detailed
derivation of this framework, overview prior work that has drawn on this and
related ideas to propose new reinforcement learning and control algorithms, and
describe perspectives on future research.","Levine, Sergey",2018,,,,arXiv preprint arXiv:1805.00909
Fine-Tuning LLMs to Analyze Multiple Dimensions of Code Review: A Maximum Entropy Regulated Long Chain-of-Thought Approach,http://arxiv.org/abs/2509.21170v1,nigam1999using,\cite{nigam1999using},Using maximum entropy for text classification,,,"Nigam, Kamal and Lafferty, John and McCallum, Andrew",1999,,,,
Fine-Tuning LLMs to Analyze Multiple Dimensions of Code Review: A Maximum Entropy Regulated Long Chain-of-Thought Approach,http://arxiv.org/abs/2509.21170v1,el2015arabic,\cite{el2015arabic},Arabic text classification using maximum entropy,,,"El-Halees, Alaa M",2015,,,,IUG Journal of Natural Studies
Fine-Tuning LLMs to Analyze Multiple Dimensions of Code Review: A Maximum Entropy Regulated Long Chain-of-Thought Approach,http://arxiv.org/abs/2509.21170v1,och2002discriminative,\cite{och2002discriminative},Discriminative training and maximum entropy models for statistical machine translation,,,"Och, Franz Josef and Ney, Hermann",2002,,,,
Fine-Tuning LLMs to Analyze Multiple Dimensions of Code Review: A Maximum Entropy Regulated Long Chain-of-Thought Approach,http://arxiv.org/abs/2509.21170v1,ittycheriah2005maximum,\cite{ittycheriah2005maximum},A maximum entropy word aligner for arabic-english machine translation,,,"Ittycheriah, Abraham and Roukos, Salim",2005,,,,
