parent_paper_title,parent_arxiv_link,citation_shorthand,raw_citation_text,cited_paper_title,cited_paper_arxiv_link,cited_paper_abstract,bib_paper_authors,bib_paper_year,bib_paper_month,bib_paper_url,bib_paper_doi,bib_paper_journal
Beyond Pairwise Connections: Extracting High-Order Functional Brain Network Structures under Global Constraints,http://arxiv.org/abs/2510.09175v1,zheng2024brainib,\cite{zheng2024brainib},"BrainIB: Interpretable Brain Network-based Psychiatric Diagnosis with
  Graph Information Bottleneck",http://arxiv.org/abs/2205.03612v4,"Developing a new diagnostic models based on the underlying biological
mechanisms rather than subjective symptoms for psychiatric disorders is an
emerging consensus. Recently, machine learning-based classifiers using
functional connectivity (FC) for psychiatric disorders and healthy controls are
developed to identify brain markers. However, existing machine learning-based
diagnostic models are prone to over-fitting (due to insufficient training
samples) and perform poorly in new test environment. Furthermore, it is
difficult to obtain explainable and reliable brain biomarkers elucidating the
underlying diagnostic decisions. These issues hinder their possible clinical
applications. In this work, we propose BrainIB, a new graph neural network
(GNN) framework to analyze functional magnetic resonance images (fMRI), by
leveraging the famed Information Bottleneck (IB) principle. BrainIB is able to
identify the most informative edges in the brain (i.e., subgraph) and
generalizes well to unseen data. We evaluate the performance of BrainIB against
3 baselines and 7 state-of-the-art brain network classification methods on
three psychiatric datasets and observe that our BrainIB always achieves the
highest diagnosis accuracy. It also discovers the subgraph biomarkers which are
consistent to clinical and neuroimaging findings. The source code and
implementation details of BrainIB are freely available at GitHub repository
(https://github.com/SJYuCNEL/brain-and-Information-Bottleneck/).","Zheng, Kaizhong and Yu, Shujian and Li, Baojuan and Jenssen, Robert and Chen, Badong",2024,,,,IEEE Trans. Neural. Netw. Learn. Syst.
Beyond Pairwise Connections: Extracting High-Order Functional Brain Network Structures under Global Constraints,http://arxiv.org/abs/2510.09175v1,wang2023prose,\cite{wang2023prose},PROSE: Graph Structure Learning via Progressive Strategy,,,"Wang, Huizhao and Fu, Yao and Yu, Tao and Hu, Linghui and Jiang, Weihao and Pu, Shiliang",2023,,,,
Beyond Pairwise Connections: Extracting High-Order Functional Brain Network Structures under Global Constraints,http://arxiv.org/abs/2510.09175v1,smith2011network,\cite{smith2011network},Network modelling methods for FMRI,,,"Smith, Stephen M and Miller, Karla L and Salimi-Khorshidi, Gholamreza and Webster, Matthew and Beckmann, Christian F and Nichols, Thomas E and Ramsey, Joseph D and Woolrich, Mark W",2011,,,,Neuroimage
Beyond Pairwise Connections: Extracting High-Order Functional Brain Network Structures under Global Constraints,http://arxiv.org/abs/2510.09175v1,wang2023bayesian,\cite{wang2023bayesian},A Bayesian Graph Neural Network for EEG Classification—A Win-Win on Performance and Interpretability,,,"Wang, Jing and Ning, Xiaojun and Shi, Wangjun and Lin, Youfang",2023,,,,
Beyond Pairwise Connections: Extracting High-Order Functional Brain Network Structures under Global Constraints,http://arxiv.org/abs/2510.09175v1,power2010development,\cite{power2010development},The development of human functional brain networks,,,"Power, Jonathan D and Fair, Damien A and Schlaggar, Bradley L and Petersen, Steven E",2010,,,,Neuron
Beyond Pairwise Connections: Extracting High-Order Functional Brain Network Structures under Global Constraints,http://arxiv.org/abs/2510.09175v1,castaldo2023multi,\cite{castaldo2023multi},Multi-modal and multi-model interrogation of large-scale functional brain networks,,,"Castaldo, Francesca and Dos Santos, Francisco P{\'a}scoa and Timms, Ryan C and Cabral, Joana and Vohryzek, Jakub and Deco, Gustavo and Woolrich, Mark and Friston, Karl and Verschure, Paul and Litvak, Vladimir",2023,,,,NeuroImage
Beyond Pairwise Connections: Extracting High-Order Functional Brain Network Structures under Global Constraints,http://arxiv.org/abs/2510.09175v1,qiao2018data,\cite{qiao2018data},Data-driven graph construction and graph learning: A review,,,"Qiao, Lishan and Zhang, Limei and Chen, Songcan and Shen, Dinggang",2018,,,,Neurocomputing
Beyond Pairwise Connections: Extracting High-Order Functional Brain Network Structures under Global Constraints,http://arxiv.org/abs/2510.09175v1,kan2022fbnetgen,\cite{kan2022fbnetgen},"FBNETGEN: Task-aware GNN-based fMRI Analysis via Functional Brain
  Network Generation",http://arxiv.org/abs/2205.12465v2,"Functional magnetic resonance imaging (fMRI) is one of the most common
imaging modalities to investigate brain functions. Recent studies in
neuroscience stress the great potential of functional brain networks
constructed from fMRI data for clinical predictions. Traditional functional
brain networks, however, are noisy and unaware of downstream prediction tasks,
while also incompatible with the deep graph neural network (GNN) models. In
order to fully unleash the power of GNNs in network-based fMRI analysis, we
develop FBNETGEN, a task-aware and interpretable fMRI analysis framework via
deep brain network generation. In particular, we formulate (1) prominent region
of interest (ROI) features extraction, (2) brain networks generation, and (3)
clinical predictions with GNNs, in an end-to-end trainable model under the
guidance of particular prediction tasks. Along with the process, the key novel
component is the graph generator which learns to transform raw time-series
features into task-oriented brain networks. Our learnable graphs also provide
unique interpretations by highlighting prediction-related brain regions.
Comprehensive experiments on two datasets, i.e., the recently released and
currently largest publicly available fMRI dataset Adolescent Brain Cognitive
Development (ABCD), and the widely-used fMRI dataset PNC, prove the superior
effectiveness and interpretability of FBNETGEN. The implementation is available
at https://github.com/Wayfear/FBNETGEN.","Kan, Xuan and Cui, Hejie and Lukemire, Joshua and Guo, Ying and Yang, Carl",2022,,,,
Beyond Pairwise Connections: Extracting High-Order Functional Brain Network Structures under Global Constraints,http://arxiv.org/abs/2510.09175v1,wegner2024nonparametric,\cite{wegner2024nonparametric},Nonparametric inference of higher order interaction patterns in networks,http://arxiv.org/abs/2403.15635v2,"We propose a method for obtaining parsimonious decompositions of networks
into higher order interactions which can take the form of arbitrary motifs.The
method is based on a class of analytically solvable generative models, where
vertices are connected via explicit copies of motifs, which in combination with
non-parametric priors allow us to infer higher order interactions from dyadic
graph data without any prior knowledge on the types or frequencies of such
interactions. Crucially, we also consider 'degree--corrected' models that
correctly reflect the degree distribution of the network and consequently prove
to be a better fit for many real world--networks compared to non-degree
corrected models. We test the presented approach on simulated data for which we
recover the set of underlying higher order interactions to a high degree of
accuracy. For empirical networks the method identifies concise sets of atomic
subgraphs from within thousands of candidates that cover a large fraction of
edges and include higher order interactions of known structural and functional
significance. The method not only produces an explicit higher order
representation of the network but also a fit of the network to analytically
tractable models opening new avenues for the systematic study of higher order
network structures.","Wegner, Anatol E and Olhede, Sofia C",2024,,,,Communications Physics
Beyond Pairwise Connections: Extracting High-Order Functional Brain Network Structures under Global Constraints,http://arxiv.org/abs/2510.09175v1,zang2024stepwise,\cite{zang2024stepwise},Stepwise reconstruction of higher-order networks from dynamics,,,"Zang, Yingbang and Fan, Ziye and Wang, Zixi and Zheng, Yi and Ding, Li and Wu, Xiaoqun",2024,,,,Chaos: An Interdisciplinary Journal of Nonlinear Science
Beyond Pairwise Connections: Extracting High-Order Functional Brain Network Structures under Global Constraints,http://arxiv.org/abs/2510.09175v1,tabar2024revealing,\cite{tabar2024revealing},Revealing higher-order interactions in high-dimensional complex systems: A data-driven approach,,,"Tabar, M Reza Rahimi and Nikakhtar, Farnik and Parkavousi, Laya and Akhshi, Amin and Feudel, Ulrike and Lehnertz, Klaus",2024,,,,Physical Review X
Beyond Pairwise Connections: Extracting High-Order Functional Brain Network Structures under Global Constraints,http://arxiv.org/abs/2510.09175v1,young2021hypergraph,\cite{young2021hypergraph},Hypergraph reconstruction from network data,http://arxiv.org/abs/2008.04948v4,"Networks can describe the structure of a wide variety of complex systems by
specifying which pairs of entities in the system are connected. While such
pairwise representations are flexible, they are not necessarily appropriate
when the fundamental interactions involve more than two entities at the same
time. Pairwise representations nonetheless remain ubiquitous, because
higher-order interactions are often not recorded explicitly in network data.
Here, we introduce a Bayesian approach to reconstruct latent higher-order
interactions from ordinary pairwise network data. Our method is based on the
principle of parsimony and only includes higher-order structures when there is
sufficient statistical evidence for them. We demonstrate its applicability to a
wide range of datasets, both synthetic and empirical.","Young, Jean-Gabriel and Petri, Giovanni and Peixoto, Tiago P",2021,,,,Communications Physics
Beyond Pairwise Connections: Extracting High-Order Functional Brain Network Structures under Global Constraints,http://arxiv.org/abs/2510.09175v1,contisciani2022inference,\cite{contisciani2022inference},Inference of hyperedges and overlapping communities in hypergraphs,http://arxiv.org/abs/2204.05646v2,"Hypergraphs, encoding structured interactions among any number of system
units, have recently proven a successful tool to describe many real-world
biological and social networks. Here we propose a framework based on
statistical inference to characterize the structural organization of
hypergraphs. The method allows to infer missing hyperedges of any size in a
principled way, and to jointly detect overlapping communities in presence of
higher-order interactions. Furthermore, our model has an efficient numerical
implementation, and it runs faster than dyadic algorithms on pairwise records
projected from higher-order data. We apply our method to a variety of
real-world systems, showing strong performance in hyperedge prediction tasks,
detecting communities well aligned with the information carried by
interactions, and robustness against addition of noisy hyperedges. Our approach
illustrates the fundamental advantages of a hypergraph probabilistic model when
modeling relational systems with higher-order interactions.","Contisciani, Martina and Battiston, Federico and De Bacco, Caterina",2022,,,,Nature communications
Beyond Pairwise Connections: Extracting High-Order Functional Brain Network Structures under Global Constraints,http://arxiv.org/abs/2510.09175v1,wang2022full,\cite{wang2022full},Full reconstruction of simplicial complexes from binary contagion and Ising data,,,"Wang, Huan and Ma, Chuang and Chen, Han-Shuang and Lai, Ying-Cheng and Zhang, Hai-Feng",2022,,,,Nature communications
Beyond Pairwise Connections: Extracting High-Order Functional Brain Network Structures under Global Constraints,http://arxiv.org/abs/2510.09175v1,malizia2024reconstructing,\cite{malizia2024reconstructing},Reconstructing higher-order interactions in coupled dynamical systems,http://arxiv.org/abs/2305.06609v1,"Higher-order interactions play a key role for the stability and function of a
complex system. However, how to identify them is still an open problem. Here,
we propose a method to fully reconstruct the structural connectivity of a
system of coupled dynamical units, identifying both pairwise and higher-order
interactions from the system time evolution. Our method works for any dynamics,
and allows the reconstruction of both hypergraphs and simplicial complexes,
either undirected or directed, unweighted or weighted. With two concrete
applications, we show how the method can help understanding the ecosystemic
complexity of bacterial systems, or the microscopic mechanisms of interaction
underlying coupled chaotic oscillators.","Malizia, Federico and Corso, Alessandra and Gambuzza, Lucia Valentina and Russo, Giovanni and Latora, Vito and Frasca, Mattia",2024,,,,Nature Communications
Beyond Pairwise Connections: Extracting High-Order Functional Brain Network Structures under Global Constraints,http://arxiv.org/abs/2510.09175v1,delabays2025hypergraph,\cite{delabays2025hypergraph},Hypergraph reconstruction from dynamics,http://arxiv.org/abs/2402.00078v3,"A plethora of methods have been developed in the past two decades to infer
the underlying network structure of an interconnected system from its
collective dynamics. However, methods capable of inferring nonpairwise
interactions are only starting to appear. Here, we develop an inference
algorithm based on sparse identification of nonlinear dynamics (SINDy) to
reconstruct hypergraphs and simplicial complexes from time-series data. Our
model-free method does not require information about node dynamics or coupling
functions, making it applicable to complex systems that do not have a reliable
mathematical description. We first benchmark the new method on synthetic data
generated from Kuramoto and Lorenz dynamics. We then use it to infer the
effective connectivity in the brain from resting-state EEG data, which reveals
significant contributions from non-pairwise interactions in shaping the
macroscopic brain dynamics.","Delabays, Robin and De Pasquale, Giulia and D{\""o}rfler, Florian and Zhang, Yuanzhao",2025,,,,Nature Communications
Beyond Pairwise Connections: Extracting High-Order Functional Brain Network Structures under Global Constraints,http://arxiv.org/abs/2510.09175v1,qiu2024learning,\cite{qiu2024learning},Learning High-Order Relationships of Brain Regions,http://arxiv.org/abs/2312.02203v3,"Discovering reliable and informative relationships among brain regions from
functional magnetic resonance imaging (fMRI) signals is essential in phenotypic
predictions. Most of the current methods fail to accurately characterize those
interactions because they only focus on pairwise connections and overlook the
high-order relationships of brain regions. We propose that these high-order
relationships should be maximally informative and minimally redundant (MIMR).
However, identifying such high-order relationships is challenging and
under-explored due to the exponential search space and the absence of a
tractable objective. In response to this gap, we propose a novel method named
HYBRID which aims to extract MIMR high-order relationships from fMRI data.
HYBRID employs a CONSTRUCTOR to identify hyperedge structures, and a WEIGHTER
to compute a weight for each hyperedge, which avoids searching in exponential
space. HYBRID achieves the MIMR objective through an innovative information
bottleneck framework named multi-head drop-bottleneck with theoretical
guarantees. Our comprehensive experiments demonstrate the effectiveness of our
model. Our model outperforms the state-of-the-art predictive model by an
average of 11.2%, regarding the quality of hyperedges measured by CPM, a
standard protocol for studying brain connections.",Weikang Qiu and Huangrui Chu and Selena Wang and Haolan Zuo and Xiaoxiao Li and Yize Zhao and Rex Ying,2024,,,,
Beyond Pairwise Connections: Extracting High-Order Functional Brain Network Structures under Global Constraints,http://arxiv.org/abs/2510.09175v1,ghalmane2020extracting,\cite{ghalmane2020extracting},Extracting Backbones in Weighted Modular Complex Networks,http://arxiv.org/abs/2008.03383v1,"Network science provides effective tools to model and analyze complex
systems. However, the increasing size of real-world networks becomes a major
hurdle in order to understand their structure and topological features.
Therefore, mapping the original network into a smaller one while preserving its
information is an important issue. Extracting the so-called backbone of a
network is a very challenging problem that is generally handled either by
coarse-graining or filter-based methods. Coarse-graining methods reduce the
network size by grouping similar nodes, while filter-based methods prune the
network by discarding nodes or edges based on a statistical property. In this
paper, we propose and investigate two filter-based methods exploiting the
overlapping community structure in order to extract the backbone in weighted
networks. Indeed, highly connected nodes (hubs) and overlapping nodes are at
the heart of the network. In the first method, called ""overlapping nodes ego
backbone"", the backbone is formed simply from the set of overlapping nodes and
their neighbors. In the second method, called ""overlapping nodes and hubs
backbone"", the backbone is formed from the set of overlapping nodes and the
hubs. For both methods, the links with the lowest weights are removed from the
network as long as a backbone with a single connected component is preserved.
Experiments have been performed on real-world weighted networks originating
from various domains (social, co-appearance, collaboration, biological, and
technological) and different sizes. Results show that both backbone extraction
methods are quite similar. Furthermore, comparison with the most influential
alternative filtering method demonstrates the greater ability of the proposed
backbones extraction methods to uncover the most relevant parts of the network.","Ghalmane, Zakariya and Cherifi, Chantal and Cherifi, Hocine and El Hassouni, Mohammed",2020,,,,Sci. Rep.
Beyond Pairwise Connections: Extracting High-Order Functional Brain Network Structures under Global Constraints,http://arxiv.org/abs/2510.09175v1,li2023interpretable,\cite{li2023interpretable},"Interpretable Sparsification of Brain Graphs: Better Practices and
  Effective Designs for Graph Neural Networks",http://arxiv.org/abs/2306.14375v1,"Brain graphs, which model the structural and functional relationships between
brain regions, are crucial in neuroscientific and clinical applications
involving graph classification. However, dense brain graphs pose computational
challenges including high runtime and memory usage and limited
interpretability. In this paper, we investigate effective designs in Graph
Neural Networks (GNNs) to sparsify brain graphs by eliminating noisy edges.
While prior works remove noisy edges based on explainability or task-irrelevant
properties, their effectiveness in enhancing performance with sparsified graphs
is not guaranteed. Moreover, existing approaches often overlook collective edge
removal across multiple graphs.
  To address these issues, we introduce an iterative framework to analyze
different sparsification models. Our findings are as follows: (i) methods
prioritizing interpretability may not be suitable for graph sparsification as
they can degrade GNNs' performance in graph classification tasks; (ii)
simultaneously learning edge selection with GNN training is more beneficial
than post-training; (iii) a shared edge selection across graphs outperforms
separate selection for each graph; and (iv) task-relevant gradient information
aids in edge selection. Based on these insights, we propose a new model,
Interpretable Graph Sparsification (IGS), which enhances graph classification
performance by up to 5.1% with 55.0% fewer edges. The retained edges identified
by IGS provide neuroscientific interpretations and are supported by
well-established literature.","Li, Gaotang and Duda, Marlena and Zhang, Xiang and Koutra, Danai and Yan, Yujun",2023,,,,
Beyond Pairwise Connections: Extracting High-Order Functional Brain Network Structures under Global Constraints,http://arxiv.org/abs/2510.09175v1,qu2025integrated,\cite{qu2025integrated},"Integrated Brain Connectivity Analysis with fMRI, DTI, and sMRI Powered
  by Interpretable Graph Neural Networks",http://arxiv.org/abs/2408.14254v2,"Multimodal neuroimaging modeling has becomes a widely used approach but
confronts considerable challenges due to heterogeneity, which encompasses
variability in data types, scales, and formats across modalities. This
variability necessitates the deployment of advanced computational methods to
integrate and interpret these diverse datasets within a cohesive analytical
framework. In our research, we amalgamate functional magnetic resonance
imaging, diffusion tensor imaging, and structural MRI into a cohesive
framework. This integration capitalizes on the unique strengths of each
modality and their inherent interconnections, aiming for a comprehensive
understanding of the brain's connectivity and anatomical characteristics.
Utilizing the Glasser atlas for parcellation, we integrate imaging derived
features from various modalities: functional connectivity from fMRI, structural
connectivity from DTI, and anatomical features from sMRI within consistent
regions. Our approach incorporates a masking strategy to differentially weight
neural connections, thereby facilitating a holistic amalgamation of multimodal
imaging data. This technique enhances interpretability at connectivity level,
transcending traditional analyses centered on singular regional attributes. The
model is applied to the Human Connectome Project's Development study to
elucidate the associations between multimodal imaging and cognitive functions
throughout youth. The analysis demonstrates improved predictive accuracy and
uncovers crucial anatomical features and essential neural connections,
deepening our understanding of brain structure and function.","Qu, Gang and Zhou, Ziyu and Calhoun, Vince D and Zhang, Aiying and Wang, Yu-Ping",2025,,,,Medical Image Analysis
Beyond Pairwise Connections: Extracting High-Order Functional Brain Network Structures under Global Constraints,http://arxiv.org/abs/2510.09175v1,zheng2024ci,\cite{zheng2024ci},Ci-gnn: A granger causality-inspired graph neural network for interpretable brain network-based psychiatric diagnosis,,,"Zheng, Kaizhong and Yu, Shujian and Chen, Badong",2024,,,,Neural. Netw.
Beyond Pairwise Connections: Extracting High-Order Functional Brain Network Structures under Global Constraints,http://arxiv.org/abs/2510.09175v1,luo2024knowledge,\cite{luo2024knowledge},Knowledge distillation guided interpretable brain subgraph neural networks for brain disorder exploration,,,"Luo, Xuexiong and Wu, Jia and Yang, Jian and Chen, Hongyang and Li, Zhao and Peng, Hao and Zhou, Chuan",2024,,,,IEEE Transactions on Neural Networks and Learning Systems
Beyond Pairwise Connections: Extracting High-Order Functional Brain Network Structures under Global Constraints,http://arxiv.org/abs/2510.09175v1,gao2024comprehensive,\cite{gao2024comprehensive},Comprehensive exploration of multi-modal and multi-branch imaging markers for autism diagnosis and interpretation: insights from an advanced deep learning model,,,"Gao, Jingjing and Xu, Yuhang and Li, Yanling and Lu, Fengmei and Wang, Zhengning",2024,,,,Cerebral Cortex
Beyond Pairwise Connections: Extracting High-Order Functional Brain Network Structures under Global Constraints,http://arxiv.org/abs/2510.09175v1,qu2023interpretable,\cite{qu2023interpretable},Interpretable cognitive ability prediction: A comprehensive gated graph transformer framework for analyzing functional brain networks,,,"Qu, Gang and Orlichenko, Anton and Wang, Junqi and Zhang, Gemeng and Xiao, Li and Zhang, Kun and Wilson, Tony W and Stephen, Julia M and Calhoun, Vince D and Wang, Yu-Ping",2023,,,,IEEE Transactions on Medical Imaging
