parent_paper_title,parent_arxiv_link,citation_shorthand,raw_citation_text,cited_paper_title,cited_paper_arxiv_link,cited_paper_abstract,bib_paper_authors,bib_paper_year,bib_paper_month,bib_paper_url,bib_paper_doi,bib_paper_journal
FreqCa: Accelerating Diffusion Models via Frequency-Aware Caching,http://arxiv.org/abs/2510.08669v1,kim2025ditto,\cite{kim2025ditto},Ditto: Accelerating Diffusion Model via Temporal Value Similarity,http://arxiv.org/abs/2501.11211v1,"Diffusion models achieve superior performance in image generation tasks.
However, it incurs significant computation overheads due to its iterative
structure. To address these overheads, we analyze this iterative structure and
observe that adjacent time steps in diffusion models exhibit high value
similarity, leading to narrower differences between consecutive time steps. We
adapt these characteristics to a quantized diffusion model and reveal that the
majority of these differences can be represented with reduced bit-width, and
even zero. Based on our observations, we propose the Ditto algorithm, a
difference processing algorithm that leverages temporal similarity with
quantization to enhance the efficiency of diffusion models. By exploiting the
narrower differences and the distributive property of layer operations, it
performs full bit-width operations for the initial time step and processes
subsequent steps with temporal differences. In addition, Ditto execution flow
optimization is designed to mitigate the memory overhead of temporal difference
processing, further boosting the efficiency of the Ditto algorithm. We also
design the Ditto hardware, a specialized hardware accelerator, fully exploiting
the dynamic characteristics of the proposed algorithm. As a result, the Ditto
hardware achieves up to 1.5x speedup and 17.74% energy saving compared to other
accelerators.",Sungbin Kim and Hyunwuk Lee and Wonho Cho and Mincheol Park and Won Woo Ro,2025,,,,
FreqCa: Accelerating Diffusion Models via Frequency-Aware Caching,http://arxiv.org/abs/2510.08669v1,bolya2023tomesd,\cite{bolya2023tomesd},Token Merging for Fast Stable Diffusion,http://arxiv.org/abs/2303.17604v1,"The landscape of image generation has been forever changed by open vocabulary
diffusion models. However, at their core these models use transformers, which
makes generation slow. Better implementations to increase the throughput of
these transformers have emerged, but they still evaluate the entire model. In
this paper, we instead speed up diffusion models by exploiting natural
redundancy in generated images by merging redundant tokens. After making some
diffusion-specific improvements to Token Merging (ToMe), our ToMe for Stable
Diffusion can reduce the number of tokens in an existing Stable Diffusion model
by up to 60% while still producing high quality images without any extra
training. In the process, we speed up image generation by up to 2x and reduce
memory consumption by up to 5.6x. Furthermore, this speed-up stacks with
efficient implementations such as xFormers, minimally impacting quality while
being up to 5.4x faster for large images. Code is available at
https://github.com/dbolya/tomesd.","Bolya, Daniel and Hoffman, Judy",,,,,
FreqCa: Accelerating Diffusion Models via Frequency-Aware Caching,http://arxiv.org/abs/2510.08669v1,kim2024tofu,\cite{kim2024tofu},Token Fusion: Bridging the Gap between Token Pruning and Token Merging,http://arxiv.org/abs/2312.01026v1,"Vision Transformers (ViTs) have emerged as powerful backbones in computer
vision, outperforming many traditional CNNs. However, their computational
overhead, largely attributed to the self-attention mechanism, makes deployment
on resource-constrained edge devices challenging. Multiple solutions rely on
token pruning or token merging. In this paper, we introduce ""Token Fusion""
(ToFu), a method that amalgamates the benefits of both token pruning and token
merging. Token pruning proves advantageous when the model exhibits sensitivity
to input interpolations, while token merging is effective when the model
manifests close to linear responses to inputs. We combine this to propose a new
scheme called Token Fusion. Moreover, we tackle the limitations of average
merging, which doesn't preserve the intrinsic feature norm, resulting in
distributional shifts. To mitigate this, we introduce MLERP merging, a variant
of the SLERP technique, tailored to merge multiple tokens while maintaining the
norm distribution. ToFu is versatile, applicable to ViTs with or without
additional training. Our empirical evaluations indicate that ToFu establishes
new benchmarks in both classification and image generation tasks concerning
computational efficiency and model accuracy.","Kim, Minchul and Gao, Shangqian and Hsu, Yen-Chang and Shen, Yilin and Jin, Hongxia",,,,,
FreqCa: Accelerating Diffusion Models via Frequency-Aware Caching,http://arxiv.org/abs/2510.08669v1,zhang2024tokenpruningcachingbetter,\cite{zhang2024tokenpruningcachingbetter},"Token Pruning for Caching Better: 9 Times Acceleration on Stable
  Diffusion for Free",http://arxiv.org/abs/2501.00375v1,"Stable Diffusion has achieved remarkable success in the field of
text-to-image generation, with its powerful generative capabilities and diverse
generation results making a lasting impact. However, its iterative denoising
introduces high computational costs and slows generation speed, limiting
broader adoption. The community has made numerous efforts to reduce this
computational burden, with methods like feature caching attracting attention
due to their effectiveness and simplicity. Nonetheless, simply reusing features
computed at previous timesteps causes the features across adjacent timesteps to
become similar, reducing the dynamics of features over time and ultimately
compromising the quality of generated images. In this paper, we introduce a
dynamics-aware token pruning (DaTo) approach that addresses the limitations of
feature caching. DaTo selectively prunes tokens with lower dynamics, allowing
only high-dynamic tokens to participate in self-attention layers, thereby
extending feature dynamics across timesteps. DaTo combines feature caching with
token pruning in a training-free manner, achieving both temporal and token-wise
information reuse. Applied to Stable Diffusion on the ImageNet, our approach
delivered a 9$\times$ speedup while reducing FID by 0.33, indicating enhanced
image quality. On the COCO-30k, we observed a 7$\times$ acceleration coupled
with a notable FID reduction of 2.17.",Evelyn Zhang and Bang Xiao and Jiayi Tang and Qianli Ma and Chang Zou and Xuefei Ning and Xuming Hu and Linfeng Zhang,2024,,https://arxiv.org/abs/2501.00375,,
FreqCa: Accelerating Diffusion Models via Frequency-Aware Caching,http://arxiv.org/abs/2510.08669v1,zhang2025sito,\cite{zhang2025sito},Training-Free and Hardware-Friendly Acceleration for Diffusion Models via Similarity-based Token Pruning,,,"Zhang, Evelyn and Tang, Jiayi and Ning, Xuefei and Zhang, Linfeng",2025,,,,
FreqCa: Accelerating Diffusion Models via Frequency-Aware Caching,http://arxiv.org/abs/2510.08669v1,li2024snapfusion,\cite{li2024snapfusion},"SnapFusion: Text-to-Image Diffusion Model on Mobile Devices within Two
  Seconds",http://arxiv.org/abs/2306.00980v3,"Text-to-image diffusion models can create stunning images from natural
language descriptions that rival the work of professional artists and
photographers. However, these models are large, with complex network
architectures and tens of denoising iterations, making them computationally
expensive and slow to run. As a result, high-end GPUs and cloud-based inference
are required to run diffusion models at scale. This is costly and has privacy
implications, especially when user data is sent to a third party. To overcome
these challenges, we present a generic approach that, for the first time,
unlocks running text-to-image diffusion models on mobile devices in less than
$2$ seconds. We achieve so by introducing efficient network architecture and
improving step distillation. Specifically, we propose an efficient UNet by
identifying the redundancy of the original model and reducing the computation
of the image decoder via data distillation. Further, we enhance the step
distillation by exploring training strategies and introducing regularization
from classifier-free guidance. Our extensive experiments on MS-COCO show that
our model with $8$ denoising steps achieves better FID and CLIP scores than
Stable Diffusion v$1.5$ with $50$ steps. Our work democratizes content creation
by bringing powerful text-to-image diffusion models to the hands of users.","Li, Yanyu and Wang, Huan and Jin, Qing and Hu, Ju and Chemerys, Pavlo and Fu, Yun and Wang, Yanzhi and Tulyakov, Sergey and Ren, Jian",,,,,Advances in Neural Information Processing Systems
FreqCa: Accelerating Diffusion Models via Frequency-Aware Caching,http://arxiv.org/abs/2510.08669v1,liu2025regionadaptivesamplingdiffusiontransformers,\cite{liu2025regionadaptivesamplingdiffusiontransformers},Region-Adaptive Sampling for Diffusion Transformers,http://arxiv.org/abs/2502.10389v1,"Diffusion models (DMs) have become the leading choice for generative tasks
across diverse domains. However, their reliance on multiple sequential forward
passes significantly limits real-time performance. Previous acceleration
methods have primarily focused on reducing the number of sampling steps or
reusing intermediate results, failing to leverage variations across spatial
regions within the image due to the constraints of convolutional U-Net
structures. By harnessing the flexibility of Diffusion Transformers (DiTs) in
handling variable number of tokens, we introduce RAS, a novel, training-free
sampling strategy that dynamically assigns different sampling ratios to regions
within an image based on the focus of the DiT model. Our key observation is
that during each sampling step, the model concentrates on semantically
meaningful regions, and these areas of focus exhibit strong continuity across
consecutive steps. Leveraging this insight, RAS updates only the regions
currently in focus, while other regions are updated using cached noise from the
previous step. The model's focus is determined based on the output from the
preceding step, capitalizing on the temporal consistency we observed. We
evaluate RAS on Stable Diffusion 3 and Lumina-Next-T2I, achieving speedups up
to 2.36x and 2.51x, respectively, with minimal degradation in generation
quality. Additionally, a user study reveals that RAS delivers comparable
qualities under human evaluation while achieving a 1.6x speedup. Our approach
makes a significant step towards more efficient diffusion transformers,
enhancing their potential for real-time applications.",Ziming Liu and Yifan Yang and Chengruidong Zhang and Yiqi Zhang and Lili Qiu and Yang You and Yuqing Yang,2025,,https://arxiv.org/abs/2502.10389,,
FreqCa: Accelerating Diffusion Models via Frequency-Aware Caching,http://arxiv.org/abs/2510.08669v1,qiu2025acceleratingdiffusiontransformererroroptimized,\cite{qiu2025acceleratingdiffusiontransformererroroptimized},Accelerating Diffusion Transformer via Error-Optimized Cache,http://arxiv.org/abs/2501.19243v3,"Diffusion Transformer (DiT) is a crucial method for content generation.
However, it needs a lot of time to sample. Many studies have attempted to use
caching to reduce the time consumption of sampling. Existing caching methods
accelerate generation by reusing DiT features from the previous time step and
skipping calculations in the next, but they tend to locate and cache low-error
modules without focusing on reducing caching-induced errors, resulting in a
sharp decline in generated content quality when increasing caching intensity.
To solve this problem, we propose the \textbf{E}rror-\textbf{O}ptimized
\textbf{C}ache (\textbf{EOC}). This method introduces three key improvements:
\textbf{(1)} Prior knowledge extraction: Extract and process the caching
differences; \textbf{(2)} A judgment method for cache optimization: Determine
whether certain caching steps need to be optimized; \textbf{(3)} Cache
optimization: reduce caching errors. Experiments show that this algorithm
significantly reduces the error accumulation caused by caching, especially
excessive caching. On the ImageNet dataset, without substantially increasing
the computational load, this method improves the FID of the generated images
when the rule-based model FORA has a caching level of \textbf{75}\%,
\textbf{50}\%, and \textbf{25}\%, and the training-based model
Learning-to-cache has a caching level of \textbf{22}\%. Specifically, the FID
values change from 30.454 to 21.690 (\textbf{28.8}\%), from 6.857 to 5.821
(\textbf{15.1}\%), from 3.870 to 3.692 (\textbf{4.6}\%), and from 3.539 to
3.451 (\textbf{2.5}\%) respectively. Code is available at
https://github.com/qiujx0520/EOC_MM2025.git.",Junxiang Qiu and Shuo Wang and Jinda Lu and Lin Liu and Houcheng Jiang and Yanbin Hao,2025,,https://arxiv.org/abs/2501.19243,,
FreqCa: Accelerating Diffusion Models via Frequency-Aware Caching,http://arxiv.org/abs/2510.08669v1,chenIncrementCalibrated2025,\cite{chenIncrementCalibrated2025},"Accelerating Diffusion Transformer via Increment-Calibrated Caching with
  Channel-Aware Singular Value Decomposition",http://arxiv.org/abs/2505.05829v1,"Diffusion transformer (DiT) models have achieved remarkable success in image
generation, thanks for their exceptional generative capabilities and
scalability. Nonetheless, the iterative nature of diffusion models (DMs)
results in high computation complexity, posing challenges for deployment.
Although existing cache-based acceleration methods try to utilize the inherent
temporal similarity to skip redundant computations of DiT, the lack of
correction may induce potential quality degradation. In this paper, we propose
increment-calibrated caching, a training-free method for DiT acceleration,
where the calibration parameters are generated from the pre-trained model
itself with low-rank approximation. To deal with the possible correction
failure arising from outlier activations, we introduce channel-aware Singular
Value Decomposition (SVD), which further strengthens the calibration effect.
Experimental results show that our method always achieve better performance
than existing naive caching methods with a similar computation resource budget.
When compared with 35-step DDIM, our method eliminates more than 45%
computation and improves IS by 12 at the cost of less than 0.06 FID increase.
Code is available at https://github.com/ccccczzy/icc.","Chen, Zhiyuan and Li, Keyi and Jia, Yifan and Ye, Le and Ma, Yufei",2025,,,10.48550/arXiv.2505.05829,
FreqCa: Accelerating Diffusion Models via Frequency-Aware Caching,http://arxiv.org/abs/2510.08669v1,chuOmniCache2025,\cite{chuOmniCache2025},"OmniCache: A Trajectory-Oriented Global Perspective on Training-Free
  Cache Reuse for Diffusion Transformer Models",http://arxiv.org/abs/2508.16212v2,"Diffusion models have emerged as a powerful paradigm for generative tasks
such as image synthesis and video generation, with Transformer architectures
further enhancing performance. However, the high computational cost of
diffusion Transformers-stemming from a large number of sampling steps and
complex per-step computations-presents significant challenges for real-time
deployment. In this paper, we introduce OmniCache, a training-free acceleration
method that exploits the global redundancy inherent in the denoising process.
Unlike existing methods that determine caching strategies based on inter-step
similarities and tend to prioritize reusing later sampling steps, our approach
originates from the sampling perspective of DIT models. We systematically
analyze the model's sampling trajectories and strategically distribute cache
reuse across the entire sampling process. This global perspective enables more
effective utilization of cached computations throughout the diffusion
trajectory, rather than concentrating reuse within limited segments of the
sampling procedure. In addition, during cache reuse, we dynamically estimate
the corresponding noise and filter it out to reduce its impact on the sampling
direction. Extensive experiments demonstrate that our approach accelerates the
sampling process while maintaining competitive generative quality, offering a
promising and practical solution for efficient deployment of diffusion-based
generative models.","Chu, Huanpeng and Wu, Wei and Fen, Guanyu and Zhang, Yutao",2025,,,10.48550/arXiv.2508.16212,
FreqCa: Accelerating Diffusion Models via Frequency-Aware Caching,http://arxiv.org/abs/2510.08669v1,zhengFoCa2025,\cite{zhengFoCa2025},"Forecast then Calibrate: Feature Caching as ODE for Efficient Diffusion
  Transformers",http://arxiv.org/abs/2508.16211v1,"Diffusion Transformers (DiTs) have demonstrated exceptional performance in
high-fidelity image and video generation. To reduce their substantial
computational costs, feature caching techniques have been proposed to
accelerate inference by reusing hidden representations from previous timesteps.
However, current methods often struggle to maintain generation quality at high
acceleration ratios, where prediction errors increase sharply due to the
inherent instability of long-step forecasting. In this work, we adopt an
ordinary differential equation (ODE) perspective on the hidden-feature
sequence, modeling layer representations along the trajectory as a feature-ODE.
We attribute the degradation of existing caching strategies to their inability
to robustly integrate historical features under large skipping intervals. To
address this, we propose FoCa (Forecast-then-Calibrate), which treats feature
caching as a feature-ODE solving problem. Extensive experiments on image
synthesis, video generation, and super-resolution tasks demonstrate the
effectiveness of FoCa, especially under aggressive acceleration. Without
additional training, FoCa achieves near-lossless speedups of 5.50 times on
FLUX, 6.45 times on HunyuanVideo, 3.17 times on Inf-DiT, and maintains high
quality with a 4.53 times speedup on DiT.","Zheng, Shikang and Feng, Liang and Wang, Xinyu and Zhou, Qinming and Cai, Peiliang and Zou, Chang and Liu, Jiacheng and Lin, Yuqi and Chen, Junjie and Ma, Yue and Zhang, Linfeng",2025,,,10.48550/arXiv.2508.16211,
FreqCa: Accelerating Diffusion Models via Frequency-Aware Caching,http://arxiv.org/abs/2510.08669v1,fengHiCache2025,\cite{fengHiCache2025},"HiCache: Training-free Acceleration of Diffusion Models via Hermite
  Polynomial-based Feature Caching",http://arxiv.org/abs/2508.16984v1,"Diffusion models have achieved remarkable success in content generation but
suffer from prohibitive computational costs due to iterative sampling. While
recent feature caching methods tend to accelerate inference through temporal
extrapolation, these methods still suffer from server quality loss due to the
failure in modeling the complex dynamics of feature evolution. To solve this
problem, this paper presents HiCache, a training-free acceleration framework
that fundamentally improves feature prediction by aligning mathematical tools
with empirical properties. Our key insight is that feature derivative
approximations in Diffusion Transformers exhibit multivariate Gaussian
characteristics, motivating the use of Hermite polynomials-the potentially
theoretically optimal basis for Gaussian-correlated processes. Besides, We
further introduce a dual-scaling mechanism that ensures numerical stability
while preserving predictive accuracy. Extensive experiments demonstrate
HiCache's superiority: achieving 6.24x speedup on FLUX.1-dev while exceeding
baseline quality, maintaining strong performance across text-to-image, video
generation, and super-resolution tasks. Core implementation is provided in the
appendix, with complete code to be released upon acceptance.","Feng, Liang and Zheng, Shikang and Liu, Jiacheng and Lin, Yuqi and Zhou, Qinming and Cai, Peiliang and Wang, Xinyu and Chen, Junjie and Zou, Chang and Ma, Yue and Zhang, Linfeng",2025,,,10.48550/arXiv.2508.16984,
FreqCa: Accelerating Diffusion Models via Frequency-Aware Caching,http://arxiv.org/abs/2510.08669v1,Liu2025SpeCa,\cite{Liu2025SpeCa},"SpeCa: Accelerating Diffusion Transformers with Speculative Feature
  Caching",http://arxiv.org/abs/2509.11628v1,"Diffusion models have revolutionized high-fidelity image and video synthesis,
yet their computational demands remain prohibitive for real-time applications.
These models face two fundamental challenges: strict temporal dependencies
preventing parallelization, and computationally intensive forward passes
required at each denoising step. Drawing inspiration from speculative decoding
in large language models, we present SpeCa, a novel 'Forecast-then-verify'
acceleration framework that effectively addresses both limitations. SpeCa's
core innovation lies in introducing Speculative Sampling to diffusion models,
predicting intermediate features for subsequent timesteps based on fully
computed reference timesteps. Our approach implements a parameter-free
verification mechanism that efficiently evaluates prediction reliability,
enabling real-time decisions to accept or reject each prediction while
incurring negligible computational overhead. Furthermore, SpeCa introduces
sample-adaptive computation allocation that dynamically modulates resources
based on generation complexity, allocating reduced computation for simpler
samples while preserving intensive processing for complex instances.
Experiments demonstrate 6.34x acceleration on FLUX with minimal quality
degradation (5.5% drop), 7.3x speedup on DiT while preserving generation
fidelity, and 79.84% VBench score at 6.1x acceleration for HunyuanVideo. The
verification mechanism incurs minimal overhead (1.67%-3.5% of full inference
costs), establishing a new paradigm for efficient diffusion model inference
while maintaining generation quality even at aggressive acceleration ratios.
Our codes have been released in Github:
\textbf{https://github.com/Shenyi-Z/Cache4Diffusion}","Liu, Jiacheng and Zou, Chang and Lyu, Yuanhuiyi and Li, Kaixin and Wang, Shaobo and Zhang, Linfeng",2025,October,,,
FreqCa: Accelerating Diffusion Models via Frequency-Aware Caching,http://arxiv.org/abs/2510.08669v1,zhao2024PAB,\cite{zhao2024PAB},Real-Time Video Generation with Pyramid Attention Broadcast,http://arxiv.org/abs/2408.12588v3,"We present Pyramid Attention Broadcast (PAB), a real-time, high quality and
training-free approach for DiT-based video generation. Our method is founded on
the observation that attention difference in the diffusion process exhibits a
U-shaped pattern, indicating significant redundancy. We mitigate this by
broadcasting attention outputs to subsequent steps in a pyramid style. It
applies different broadcast strategies to each attention based on their
variance for best efficiency. We further introduce broadcast sequence parallel
for more efficient distributed inference. PAB demonstrates up to 10.5x speedup
across three models compared to baselines, achieving real-time generation for
up to 720p videos. We anticipate that our simple yet effective method will
serve as a robust baseline and facilitate future research and application for
video generation.","Zhao, Xuanlei and Jin, Xiaolong and Wang, Kai and You, Yang",,,,,arXiv preprint arXiv:2408.12588
FreqCa: Accelerating Diffusion Models via Frequency-Aware Caching,http://arxiv.org/abs/2510.08669v1,lvFasterCacheTrainingFreeVideo2025,\cite{lvFasterCacheTrainingFreeVideo2025},"FasterCache: Training-Free Video Diffusion Model Acceleration with High
  Quality",http://arxiv.org/abs/2410.19355v2,"In this paper, we present \textbf{\textit{FasterCache}}, a novel
training-free strategy designed to accelerate the inference of video diffusion
models with high-quality generation. By analyzing existing cache-based methods,
we observe that \textit{directly reusing adjacent-step features degrades video
quality due to the loss of subtle variations}. We further perform a pioneering
investigation of the acceleration potential of classifier-free guidance (CFG)
and reveal significant redundancy between conditional and unconditional
features within the same timestep. Capitalizing on these observations, we
introduce FasterCache to substantially accelerate diffusion-based video
generation. Our key contributions include a dynamic feature reuse strategy that
preserves both feature distinction and temporal continuity, and CFG-Cache which
optimizes the reuse of conditional and unconditional outputs to further enhance
inference speed without compromising video quality. We empirically evaluate
FasterCache on recent video diffusion models. Experimental results show that
FasterCache can significantly accelerate video generation (\eg 1.67$\times$
speedup on Vchitect-2.0) while keeping video quality comparable to the
baseline, and consistently outperform existing methods in both inference speed
and video quality.","Lv, Zhengyao and Si, Chenyang and Song, Junhao and Yang, Zhenyu and Qiao, Yu and Liu, Ziwei and Wong, Kwan-Yee K.",2025,,,10.48550/arXiv.2410.19355,
