parent_paper_title,parent_arxiv_link,citation_shorthand,raw_citation_text,cited_paper_title,cited_paper_arxiv_link,cited_paper_abstract,bib_paper_authors,bib_paper_year,bib_paper_month,bib_paper_url,bib_paper_doi,bib_paper_journal
FreqCa: Accelerating Diffusion Models via Frequency-Aware Caching,http://arxiv.org/abs/2510.08669v1,sohl2015deep,\cite{sohl2015deep},Deep Unsupervised Learning using Nonequilibrium Thermodynamics,http://arxiv.org/abs/1503.03585v8,"A central problem in machine learning involves modeling complex data-sets
using highly flexible families of probability distributions in which learning,
sampling, inference, and evaluation are still analytically or computationally
tractable. Here, we develop an approach that simultaneously achieves both
flexibility and tractability. The essential idea, inspired by non-equilibrium
statistical physics, is to systematically and slowly destroy structure in a
data distribution through an iterative forward diffusion process. We then learn
a reverse diffusion process that restores structure in data, yielding a highly
flexible and tractable generative model of the data. This approach allows us to
rapidly learn, sample from, and evaluate probabilities in deep generative
models with thousands of layers or time steps, as well as to compute
conditional and posterior probabilities under the learned model. We
additionally release an open source reference implementation of the algorithm.","Sohl-Dickstein, Jascha and Weiss, Eric and Maheswaranathan, Niru and Ganguli, Surya",,,,,
FreqCa: Accelerating Diffusion Models via Frequency-Aware Caching,http://arxiv.org/abs/2510.08669v1,ho2020DDPM,\cite{ho2020DDPM},Denoising Diffusion Probabilistic Models,http://arxiv.org/abs/2006.11239v2,"We present high quality image synthesis results using diffusion probabilistic
models, a class of latent variable models inspired by considerations from
nonequilibrium thermodynamics. Our best results are obtained by training on a
weighted variational bound designed according to a novel connection between
diffusion probabilistic models and denoising score matching with Langevin
dynamics, and our models naturally admit a progressive lossy decompression
scheme that can be interpreted as a generalization of autoregressive decoding.
On the unconditional CIFAR10 dataset, we obtain an Inception score of 9.46 and
a state-of-the-art FID score of 3.17. On 256x256 LSUN, we obtain sample quality
similar to ProgressiveGAN. Our implementation is available at
https://github.com/hojonathanho/diffusion","Ho, Jonathan and Jain, Ajay and Abbeel, Pieter",,,,,Advances in neural information processing systems
FreqCa: Accelerating Diffusion Models via Frequency-Aware Caching,http://arxiv.org/abs/2510.08669v1,ronneberger2015unet,\cite{ronneberger2015unet},U-net: Convolutional networks for biomedical image segmentation,,,"Ronneberger, Olaf and Fischer, Philipp and Brox, Thomas",,,,,
FreqCa: Accelerating Diffusion Models via Frequency-Aware Caching,http://arxiv.org/abs/2510.08669v1,peebles2023dit,\cite{peebles2023dit},Scalable Diffusion Models with Transformers,http://arxiv.org/abs/2212.09748v2,"We explore a new class of diffusion models based on the transformer
architecture. We train latent diffusion models of images, replacing the
commonly-used U-Net backbone with a transformer that operates on latent
patches. We analyze the scalability of our Diffusion Transformers (DiTs)
through the lens of forward pass complexity as measured by Gflops. We find that
DiTs with higher Gflops -- through increased transformer depth/width or
increased number of input tokens -- consistently have lower FID. In addition to
possessing good scalability properties, our largest DiT-XL/2 models outperform
all prior diffusion models on the class-conditional ImageNet 512x512 and
256x256 benchmarks, achieving a state-of-the-art FID of 2.27 on the latter.","Peebles, William and Xie, Saining",,,,,
FreqCa: Accelerating Diffusion Models via Frequency-Aware Caching,http://arxiv.org/abs/2510.08669v1,opensora,\cite{opensora},Open-Sora: Democratizing Efficient Video Production for All,,,Zangwei Zheng and Xiangyu Peng and Tianji Yang and Chenhui Shen and Shenggui Li and Hongxin Liu and Yukun Zhou and Tianyi Li and Yang You,,March,https://github.com/hpcaitech/Open-Sora,,
FreqCa: Accelerating Diffusion Models via Frequency-Aware Caching,http://arxiv.org/abs/2510.08669v1,yang2025cogvideox,\cite{yang2025cogvideox},CogVideoX: Text-to-Video Diffusion Models with An Expert Transformer,http://arxiv.org/abs/2408.06072v3,"We present CogVideoX, a large-scale text-to-video generation model based on
diffusion transformer, which can generate 10-second continuous videos aligned
with text prompt, with a frame rate of 16 fps and resolution of 768 * 1360
pixels. Previous video generation models often had limited movement and short
durations, and is difficult to generate videos with coherent narratives based
on text. We propose several designs to address these issues. First, we propose
a 3D Variational Autoencoder (VAE) to compress videos along both spatial and
temporal dimensions, to improve both compression rate and video fidelity.
Second, to improve the text-video alignment, we propose an expert transformer
with the expert adaptive LayerNorm to facilitate the deep fusion between the
two modalities. Third, by employing a progressive training and multi-resolution
frame pack technique, CogVideoX is adept at producing coherent, long-duration,
different shape videos characterized by significant motions. In addition, we
develop an effective text-video data processing pipeline that includes various
data preprocessing strategies and a video captioning method, greatly
contributing to the generation quality and semantic alignment. Results show
that CogVideoX demonstrates state-of-the-art performance across both multiple
machine metrics and human evaluations. The model weight of both 3D Causal VAE,
Video caption model and CogVideoX are publicly available at
https://github.com/THUDM/CogVideo.",Zhuoyi Yang and Jiayan Teng and Wendi Zheng and Ming Ding and Shiyu Huang and Jiazheng Xu and Yuanming Yang and Wenyi Hong and Xiaohan Zhang and Guanyu Feng and Da Yin and Xiaotao Gu and Yuxuan.Zhang and Weihan Wang and Yean Cheng and Bin Xu and Yuxiao Dong and Jie Tang,2025,,https://openreview.net/forum?id=LQzN6TRFg9,,
FreqCa: Accelerating Diffusion Models via Frequency-Aware Caching,http://arxiv.org/abs/2510.08669v1,songDDIM,\cite{songDDIM},Denoising Diffusion Implicit Models,http://arxiv.org/abs/2010.02502v4,"Denoising diffusion probabilistic models (DDPMs) have achieved high quality
image generation without adversarial training, yet they require simulating a
Markov chain for many steps to produce a sample. To accelerate sampling, we
present denoising diffusion implicit models (DDIMs), a more efficient class of
iterative implicit probabilistic models with the same training procedure as
DDPMs. In DDPMs, the generative process is defined as the reverse of a
Markovian diffusion process. We construct a class of non-Markovian diffusion
processes that lead to the same training objective, but whose reverse process
can be much faster to sample from. We empirically demonstrate that DDIMs can
produce high quality samples $10 \times$ to $50 \times$ faster in terms of
wall-clock time compared to DDPMs, allow us to trade off computation for sample
quality, and can perform semantically meaningful image interpolation directly
in the latent space.","Song, Jiaming and Meng, Chenlin and Ermon, Stefano",,,,,
FreqCa: Accelerating Diffusion Models via Frequency-Aware Caching,http://arxiv.org/abs/2510.08669v1,lu2022dpm,\cite{lu2022dpm},Dpm-solver: A fast ode solver for diffusion probabilistic model sampling in around 10 steps,,,"Lu, Cheng and Zhou, Yuhao and Bao, Fan and Chen, Jianfei and Li, Chongxuan and Zhu, Jun",,,,,Advances in Neural Information Processing Systems
FreqCa: Accelerating Diffusion Models via Frequency-Aware Caching,http://arxiv.org/abs/2510.08669v1,lu2022dpm++,\cite{lu2022dpm++},"DPM-Solver++: Fast Solver for Guided Sampling of Diffusion Probabilistic
  Models",http://arxiv.org/abs/2211.01095v3,"Diffusion probabilistic models (DPMs) have achieved impressive success in
high-resolution image synthesis, especially in recent large-scale text-to-image
generation applications. An essential technique for improving the sample
quality of DPMs is guided sampling, which usually needs a large guidance scale
to obtain the best sample quality. The commonly-used fast sampler for guided
sampling is DDIM, a first-order diffusion ODE solver that generally needs 100
to 250 steps for high-quality samples. Although recent works propose dedicated
high-order solvers and achieve a further speedup for sampling without guidance,
their effectiveness for guided sampling has not been well-tested before. In
this work, we demonstrate that previous high-order fast samplers suffer from
instability issues, and they even become slower than DDIM when the guidance
scale grows large. To further speed up guided sampling, we propose
DPM-Solver++, a high-order solver for the guided sampling of DPMs. DPM-Solver++
solves the diffusion ODE with the data prediction model and adopts thresholding
methods to keep the solution matches training data distribution. We further
propose a multistep variant of DPM-Solver++ to address the instability issue by
reducing the effective step size. Experiments show that DPM-Solver++ can
generate high-quality samples within only 15 to 20 steps for guided sampling by
pixel-space and latent-space DPMs.","Lu, Cheng and Zhou, Yuhao and Bao, Fan and Chen, Jianfei and Li, Chongxuan and Zhu, Jun",,,,,arXiv preprint arXiv:2211.01095
FreqCa: Accelerating Diffusion Models via Frequency-Aware Caching,http://arxiv.org/abs/2510.08669v1,zheng2023dpmsolvervF,\cite{zheng2023dpmsolvervF},"DPM-Solver-v3: Improved Diffusion ODE Solver with Empirical Model
  Statistics",http://arxiv.org/abs/2310.13268v3,"Diffusion probabilistic models (DPMs) have exhibited excellent performance
for high-fidelity image generation while suffering from inefficient sampling.
Recent works accelerate the sampling procedure by proposing fast ODE solvers
that leverage the specific ODE form of DPMs. However, they highly rely on
specific parameterization during inference (such as noise/data prediction),
which might not be the optimal choice. In this work, we propose a novel
formulation towards the optimal parameterization during sampling that minimizes
the first-order discretization error of the ODE solution. Based on such
formulation, we propose DPM-Solver-v3, a new fast ODE solver for DPMs by
introducing several coefficients efficiently computed on the pretrained model,
which we call empirical model statistics. We further incorporate multistep
methods and a predictor-corrector framework, and propose some techniques for
improving sample quality at small numbers of function evaluations (NFE) or
large guidance scales. Experiments show that DPM-Solver-v3 achieves
consistently better or comparable performance in both unconditional and
conditional sampling with both pixel-space and latent-space DPMs, especially in
5$\sim$10 NFEs. We achieve FIDs of 12.21 (5 NFE), 2.51 (10 NFE) on
unconditional CIFAR10, and MSE of 0.55 (5 NFE, 7.5 guidance scale) on Stable
Diffusion, bringing a speed-up of 15%$\sim$30% compared to previous
state-of-the-art training-free methods. Code is available at
https://github.com/thu-ml/DPM-Solver-v3.",Kaiwen Zheng and Cheng Lu and Jianfei Chen and Jun Zhu,2023,,https://openreview.net/forum?id=9fWKExmKa0,,
FreqCa: Accelerating Diffusion Models via Frequency-Aware Caching,http://arxiv.org/abs/2510.08669v1,salimans2022progressive,\cite{salimans2022progressive},Progressive Distillation for Fast Sampling of Diffusion Models,http://arxiv.org/abs/2202.00512v2,"Diffusion models have recently shown great promise for generative modeling,
outperforming GANs on perceptual quality and autoregressive models at density
estimation. A remaining downside is their slow sampling time: generating high
quality samples takes many hundreds or thousands of model evaluations. Here we
make two contributions to help eliminate this downside: First, we present new
parameterizations of diffusion models that provide increased stability when
using few sampling steps. Second, we present a method to distill a trained
deterministic diffusion sampler, using many steps, into a new diffusion model
that takes half as many sampling steps. We then keep progressively applying
this distillation procedure to our model, halving the number of required
sampling steps each time. On standard image generation benchmarks like
CIFAR-10, ImageNet, and LSUN, we start out with state-of-the-art samplers
taking as many as 8192 steps, and are able to distill down to models taking as
few as 4 steps without losing much perceptual quality; achieving, for example,
a FID of 3.0 on CIFAR-10 in 4 steps. Finally, we show that the full progressive
distillation procedure does not take more time than it takes to train the
original model, thus representing an efficient solution for generative modeling
using diffusion at both train and test time.","Salimans, Tim and Ho, Jonathan",,,,,arXiv preprint arXiv:2202.00512
FreqCa: Accelerating Diffusion Models via Frequency-Aware Caching,http://arxiv.org/abs/2510.08669v1,meng2022on,\cite{meng2022on},On Distillation of Guided Diffusion Models,http://arxiv.org/abs/2210.03142v3,"Classifier-free guided diffusion models have recently been shown to be highly
effective at high-resolution image generation, and they have been widely used
in large-scale diffusion frameworks including DALLE-2, Stable Diffusion and
Imagen. However, a downside of classifier-free guided diffusion models is that
they are computationally expensive at inference time since they require
evaluating two diffusion models, a class-conditional model and an unconditional
model, tens to hundreds of times. To deal with this limitation, we propose an
approach to distilling classifier-free guided diffusion models into models that
are fast to sample from: Given a pre-trained classifier-free guided model, we
first learn a single model to match the output of the combined conditional and
unconditional models, and then we progressively distill that model to a
diffusion model that requires much fewer sampling steps. For standard diffusion
models trained on the pixel-space, our approach is able to generate images
visually comparable to that of the original model using as few as 4 sampling
steps on ImageNet 64x64 and CIFAR-10, achieving FID/IS scores comparable to
that of the original model while being up to 256 times faster to sample from.
For diffusion models trained on the latent-space (e.g., Stable Diffusion), our
approach is able to generate high-fidelity images using as few as 1 to 4
denoising steps, accelerating inference by at least 10-fold compared to
existing methods on ImageNet 256x256 and LAION datasets. We further demonstrate
the effectiveness of our approach on text-guided image editing and inpainting,
where our distilled model is able to generate high-quality results using as few
as 2-4 denoising steps.",Chenlin Meng and Ruiqi Gao and Diederik P Kingma and Stefano Ermon and Jonathan Ho and Tim Salimans,2022,,https://openreview.net/forum?id=6QHpSQt6VR-,,
FreqCa: Accelerating Diffusion Models via Frequency-Aware Caching,http://arxiv.org/abs/2510.08669v1,refitiedflow,\cite{refitiedflow},"Flow Straight and Fast: Learning to Generate and Transfer Data with
  Rectified Flow",http://arxiv.org/abs/2209.03003v1,"We present rectified flow, a surprisingly simple approach to learning
(neural) ordinary differential equation (ODE) models to transport between two
empirically observed distributions \pi_0 and \pi_1, hence providing a unified
solution to generative modeling and domain transfer, among various other tasks
involving distribution transport. The idea of rectified flow is to learn the
ODE to follow the straight paths connecting the points drawn from \pi_0 and
\pi_1 as much as possible. This is achieved by solving a straightforward
nonlinear least squares optimization problem, which can be easily scaled to
large models without introducing extra parameters beyond standard supervised
learning. The straight paths are special and preferred because they are the
shortest paths between two points, and can be simulated exactly without time
discretization and hence yield computationally efficient models. We show that
the procedure of learning a rectified flow from data, called rectification,
turns an arbitrary coupling of \pi_0 and \pi_1 to a new deterministic coupling
with provably non-increasing convex transport costs. In addition, recursively
applying rectification allows us to obtain a sequence of flows with
increasingly straight paths, which can be simulated accurately with coarse time
discretization in the inference phase. In empirical studies, we show that
rectified flow performs superbly on image generation, image-to-image
translation, and domain adaptation. In particular, on image generation and
translation, our method yields nearly straight flows that give high quality
results even with a single Euler discretization step.","Liu, Xingchao and Gong, Chengyue and others",,,,,
FreqCa: Accelerating Diffusion Models via Frequency-Aware Caching,http://arxiv.org/abs/2510.08669v1,song2023consistency,\cite{song2023consistency},Consistency Models,http://arxiv.org/abs/2303.01469v2,"Diffusion models have significantly advanced the fields of image, audio, and
video generation, but they depend on an iterative sampling process that causes
slow generation. To overcome this limitation, we propose consistency models, a
new family of models that generate high quality samples by directly mapping
noise to data. They support fast one-step generation by design, while still
allowing multistep sampling to trade compute for sample quality. They also
support zero-shot data editing, such as image inpainting, colorization, and
super-resolution, without requiring explicit training on these tasks.
Consistency models can be trained either by distilling pre-trained diffusion
models, or as standalone generative models altogether. Through extensive
experiments, we demonstrate that they outperform existing distillation
techniques for diffusion models in one- and few-step sampling, achieving the
new state-of-the-art FID of 3.55 on CIFAR-10 and 6.20 on ImageNet 64x64 for
one-step generation. When trained in isolation, consistency models become a new
family of generative models that can outperform existing one-step,
non-adversarial generative models on standard benchmarks such as CIFAR-10,
ImageNet 64x64 and LSUN 256x256.","Song, Yang and Dhariwal, Prafulla and Chen, Mark and Sutskever, Ilya",,,,,
FreqCa: Accelerating Diffusion Models via Frequency-Aware Caching,http://arxiv.org/abs/2510.08669v1,structural_pruning_diffusion,\cite{structural_pruning_diffusion},Structural Pruning for Diffusion Models,http://arxiv.org/abs/2305.10924v3,"Generative modeling has recently undergone remarkable advancements, primarily
propelled by the transformative implications of Diffusion Probabilistic Models
(DPMs). The impressive capability of these models, however, often entails
significant computational overhead during both training and inference. To
tackle this challenge, we present Diff-Pruning, an efficient compression method
tailored for learning lightweight diffusion models from pre-existing ones,
without the need for extensive re-training. The essence of Diff-Pruning is
encapsulated in a Taylor expansion over pruned timesteps, a process that
disregards non-contributory diffusion steps and ensembles informative gradients
to identify important weights. Our empirical assessment, undertaken across
several datasets highlights two primary benefits of our proposed method: 1)
Efficiency: it enables approximately a 50\% reduction in FLOPs at a mere 10\%
to 20\% of the original training expenditure; 2) Consistency: the pruned
diffusion models inherently preserve generative behavior congruent with their
pre-trained models. Code is available at
\url{https://github.com/VainF/Diff-Pruning}.","Fang, Gongfan and Ma, Xinyin and Wang, Xinchao",,,,,arXiv preprint arXiv:2305.10924
FreqCa: Accelerating Diffusion Models via Frequency-Aware Caching,http://arxiv.org/abs/2510.08669v1,zhu2024dipgo,\cite{zhu2024dipgo},DiP-GO: A Diffusion Pruner via Few-step Gradient Optimization,,,Haowei Zhu and Dehua Tang and Ji Liu and Mingjie Lu and Jintu Zheng and Jinzhang Peng and Dong Li and Yu Wang and Fan Jiang and Lu Tian and Spandan Tiwari and Ashish Sirasao and Jun-Hai Yong and Bin Wang and Emad Barsoum,2024,,,,
FreqCa: Accelerating Diffusion Models via Frequency-Aware Caching,http://arxiv.org/abs/2510.08669v1,10377259,\cite{10377259},Q-Diffusion: Quantizing Diffusion Models,http://arxiv.org/abs/2302.04304v3,"Diffusion models have achieved great success in image synthesis through
iterative noise estimation using deep neural networks. However, the slow
inference, high memory consumption, and computation intensity of the noise
estimation model hinder the efficient adoption of diffusion models. Although
post-training quantization (PTQ) is considered a go-to compression method for
other tasks, it does not work out-of-the-box on diffusion models. We propose a
novel PTQ method specifically tailored towards the unique multi-timestep
pipeline and model architecture of the diffusion models, which compresses the
noise estimation network to accelerate the generation process. We identify the
key difficulty of diffusion model quantization as the changing output
distributions of noise estimation networks over multiple time steps and the
bimodal activation distribution of the shortcut layers within the noise
estimation network. We tackle these challenges with timestep-aware calibration
and split shortcut quantization in this work. Experimental results show that
our proposed method is able to quantize full-precision unconditional diffusion
models into 4-bit while maintaining comparable performance (small FID change of
at most 2.34 compared to >100 for traditional PTQ) in a training-free manner.
Our approach can also be applied to text-guided image generation, where we can
run stable diffusion in 4-bit weights with high generation quality for the
first time.","Li, Xiuyu and Liu, Yijiang and Lian, Long and Yang, Huanrui and Dong, Zhen and Kang, Daniel and Zhang, Shanghang and Keutzer, Kurt",2023,,,10.1109/ICCV51070.2023.01608,
FreqCa: Accelerating Diffusion Models via Frequency-Aware Caching,http://arxiv.org/abs/2510.08669v1,shang2023post,\cite{shang2023post},Post-training Quantization on Diffusion Models,http://arxiv.org/abs/2211.15736v3,"Denoising diffusion (score-based) generative models have recently achieved
significant accomplishments in generating realistic and diverse data. These
approaches define a forward diffusion process for transforming data into noise
and a backward denoising process for sampling data from noise. Unfortunately,
the generation process of current denoising diffusion models is notoriously
slow due to the lengthy iterative noise estimations, which rely on cumbersome
neural networks. It prevents the diffusion models from being widely deployed,
especially on edge devices. Previous works accelerate the generation process of
diffusion model (DM) via finding shorter yet effective sampling trajectories.
However, they overlook the cost of noise estimation with a heavy network in
every iteration. In this work, we accelerate generation from the perspective of
compressing the noise estimation network. Due to the difficulty of retraining
DMs, we exclude mainstream training-aware compression paradigms and introduce
post-training quantization (PTQ) into DM acceleration. However, the output
distributions of noise estimation networks change with time-step, making
previous PTQ methods fail in DMs since they are designed for single-time step
scenarios. To devise a DM-specific PTQ method, we explore PTQ on DM in three
aspects: quantized operations, calibration dataset, and calibration metric. We
summarize and use several observations derived from all-inclusive
investigations to formulate our method, which especially targets the unique
multi-time-step structure of DMs. Experimentally, our method can directly
quantize full-precision DMs into 8-bit models while maintaining or even
improving their performance in a training-free manner. Importantly, our method
can serve as a plug-and-play module on other fast-sampling methods, e.g., DDIM.
The code is available at https://github.com/42Shawn/PTQ4DM .","Shang, Yuzhang and Yuan, Zhihang and Xie, Bin and Wu, Bingzhe and Yan, Yan",,,,,
