parent_paper_title,parent_arxiv_link,citation_shorthand,raw_citation_text,cited_paper_title,cited_paper_arxiv_link,cited_paper_abstract,bib_paper_authors,bib_paper_year,bib_paper_month,bib_paper_url,bib_paper_doi,bib_paper_journal
LLM-based Multi-Agent Blackboard System for Information Discovery in Data Science,http://arxiv.org/abs/2510.01285v1,codellama,\cite{codellama},Code Llama: Open Foundation Models for Code,http://arxiv.org/abs/2308.12950v3,"We release Code Llama, a family of large language models for code based on
Llama 2 providing state-of-the-art performance among open models, infilling
capabilities, support for large input contexts, and zero-shot instruction
following ability for programming tasks. We provide multiple flavors to cover a
wide range of applications: foundation models (Code Llama), Python
specializations (Code Llama - Python), and instruction-following models (Code
Llama - Instruct) with 7B, 13B, 34B and 70B parameters each. All models are
trained on sequences of 16k tokens and show improvements on inputs with up to
100k tokens. 7B, 13B and 70B Code Llama and Code Llama - Instruct variants
support infilling based on surrounding content. Code Llama reaches
state-of-the-art performance among open models on several code benchmarks, with
scores of up to 67% and 65% on HumanEval and MBPP, respectively. Notably, Code
Llama - Python 7B outperforms Llama 2 70B on HumanEval and MBPP, and all our
models outperform every other publicly available model on MultiPL-E. We release
Code Llama under a permissive license that allows for both research and
commercial use.",Baptiste Rozière and Jonas Gehring and Fabian Gloeckle and Sten Sootla and Itai Gat and Xiaoqing Ellen Tan and Yossi Adi and Jingyu Liu and Romain Sauvestre and Tal Remez and Jérémy Rapin and Artyom Kozhevnikov and Ivan Evtimov and Joanna Bitton and Manish Bhatt and Cristian Canton Ferrer and Aaron Grattafiori and Wenhan Xiong and Alexandre Défossez and Jade Copet and Faisal Azhar and Hugo Touvron and Louis Martin and Nicolas Usunier and Thomas Scialom and Gabriel Synnaeve,2024,,https://arxiv.org/abs/2308.12950,,
LLM-based Multi-Agent Blackboard System for Information Discovery in Data Science,http://arxiv.org/abs/2510.01285v1,yao2023react,\cite{yao2023react},ReAct: Synergizing Reasoning and Acting in Language Models,http://arxiv.org/abs/2210.03629v3,"While large language models (LLMs) have demonstrated impressive capabilities
across tasks in language understanding and interactive decision making, their
abilities for reasoning (e.g. chain-of-thought prompting) and acting (e.g.
action plan generation) have primarily been studied as separate topics. In this
paper, we explore the use of LLMs to generate both reasoning traces and
task-specific actions in an interleaved manner, allowing for greater synergy
between the two: reasoning traces help the model induce, track, and update
action plans as well as handle exceptions, while actions allow it to interface
with external sources, such as knowledge bases or environments, to gather
additional information. We apply our approach, named ReAct, to a diverse set of
language and decision making tasks and demonstrate its effectiveness over
state-of-the-art baselines, as well as improved human interpretability and
trustworthiness over methods without reasoning or acting components.
Concretely, on question answering (HotpotQA) and fact verification (Fever),
ReAct overcomes issues of hallucination and error propagation prevalent in
chain-of-thought reasoning by interacting with a simple Wikipedia API, and
generates human-like task-solving trajectories that are more interpretable than
baselines without reasoning traces. On two interactive decision making
benchmarks (ALFWorld and WebShop), ReAct outperforms imitation and
reinforcement learning methods by an absolute success rate of 34% and 10%
respectively, while being prompted with only one or two in-context examples.
Project site with code: https://react-lm.github.io","Yao, Shunyu and Zhao, Jeffrey and Yu, Dian and Du, Nan and Shafran, Izhak and Narasimhan, Karthik and Cao, Yuan",2023,,,,
LLM-based Multi-Agent Blackboard System for Information Discovery in Data Science,http://arxiv.org/abs/2510.01285v1,chen2018executionguided,\cite{chen2018executionguided},Execution-Guided Neural Program Synthesis,,,Xinyun Chen and Chang Liu and Dawn Song,2019,,https://openreview.net/forum?id=H1gfOiAqYm,,
LLM-based Multi-Agent Blackboard System for Information Discovery in Data Science,http://arxiv.org/abs/2510.01285v1,schick2023toolformer,\cite{schick2023toolformer},Toolformer: Language Models Can Teach Themselves to Use Tools,http://arxiv.org/abs/2302.04761v1,"Language models (LMs) exhibit remarkable abilities to solve new tasks from
just a few examples or textual instructions, especially at scale. They also,
paradoxically, struggle with basic functionality, such as arithmetic or factual
lookup, where much simpler and smaller models excel. In this paper, we show
that LMs can teach themselves to use external tools via simple APIs and achieve
the best of both worlds. We introduce Toolformer, a model trained to decide
which APIs to call, when to call them, what arguments to pass, and how to best
incorporate the results into future token prediction. This is done in a
self-supervised way, requiring nothing more than a handful of demonstrations
for each API. We incorporate a range of tools, including a calculator, a Q\&A
system, two different search engines, a translation system, and a calendar.
Toolformer achieves substantially improved zero-shot performance across a
variety of downstream tasks, often competitive with much larger models, without
sacrificing its core language modeling abilities.",Timo Schick and Jane Dwivedi-Yu and Roberto Dessi and Roberta Raileanu and Maria Lomeli and Eric Hambro and Luke Zettlemoyer and Nicola Cancedda and Thomas Scialom,2023,,https://openreview.net/forum?id=Yacmpz84TH,,
LLM-based Multi-Agent Blackboard System for Information Discovery in Data Science,http://arxiv.org/abs/2510.01285v1,patil2024gorilla,\cite{patil2024gorilla},Gorilla: Large Language Model Connected with Massive APIs,http://arxiv.org/abs/2305.15334v1,"Large Language Models (LLMs) have seen an impressive wave of advances
recently, with models now excelling in a variety of tasks, such as mathematical
reasoning and program synthesis. However, their potential to effectively use
tools via API calls remains unfulfilled. This is a challenging task even for
today's state-of-the-art LLMs such as GPT-4, largely due to their inability to
generate accurate input arguments and their tendency to hallucinate the wrong
usage of an API call. We release Gorilla, a finetuned LLaMA-based model that
surpasses the performance of GPT-4 on writing API calls. When combined with a
document retriever, Gorilla demonstrates a strong capability to adapt to
test-time document changes, enabling flexible user updates or version changes.
It also substantially mitigates the issue of hallucination, commonly
encountered when prompting LLMs directly. To evaluate the model's ability, we
introduce APIBench, a comprehensive dataset consisting of HuggingFace,
TorchHub, and TensorHub APIs. The successful integration of the retrieval
system with Gorilla demonstrates the potential for LLMs to use tools more
accurately, keep up with frequently updated documentation, and consequently
increase the reliability and applicability of their outputs. Gorilla's code,
model, data, and demo are available at https://gorilla.cs.berkeley.edu",Shishir G Patil and Tianjun Zhang and Xin Wang and Joseph E. Gonzalez,2024,,https://openreview.net/forum?id=tBRNC6YemY,,
LLM-based Multi-Agent Blackboard System for Information Discovery in Data Science,http://arxiv.org/abs/2510.01285v1,chen2024teaching,\cite{chen2024teaching},Teaching Large Language Models to Self-Debug,http://arxiv.org/abs/2304.05128v2,"Large language models (LLMs) have achieved impressive performance on code
generation. However, for complex programming tasks, generating the correct
solution in one go becomes challenging, thus some prior works have designed
program repair approaches to improve code generation performance. In this work,
we propose Self-Debugging, which teaches a large language model to debug its
predicted program via few-shot demonstrations. In particular, we demonstrate
that Self-Debugging can teach the large language model to perform rubber duck
debugging; i.e., without any human feedback on the code correctness or error
messages, the model is able to identify its mistakes by investigating the
execution results and explaining the generated code in natural language.
Self-Debugging achieves the state-of-the-art performance on several code
generation benchmarks, including the Spider dataset for text-to-SQL generation,
TransCoder for C++-to-Python translation, and MBPP for text-to-Python
generation. On the Spider benchmark where there are no unit tests to verify the
correctness of predictions, Self-Debugging with code explanation consistently
improves the baseline by 2-3%, and improves the prediction accuracy on problems
of the hardest level by 9%. On TransCoder and MBPP where unit tests are
available, Self-Debugging improves the baseline accuracy by up to 12%.
Meanwhile, by leveraging feedback messages and reusing failed predictions,
Self-Debugging notably improves sample efficiency, and can match or outperform
baseline models that generate more than 10x candidate programs.","Xinyun Chen and Maxwell Lin and Nathanael Sch{\""a}rli and Denny Zhou",2024,,https://openreview.net/forum?id=KuPixIqPiq,,
LLM-based Multi-Agent Blackboard System for Information Discovery in Data Science,http://arxiv.org/abs/2510.01285v1,shinn2023reflexion,\cite{shinn2023reflexion},Reflexion: Language Agents with Verbal Reinforcement Learning,http://arxiv.org/abs/2303.11366v4,"Large language models (LLMs) have been increasingly used to interact with
external environments (e.g., games, compilers, APIs) as goal-driven agents.
However, it remains challenging for these language agents to quickly and
efficiently learn from trial-and-error as traditional reinforcement learning
methods require extensive training samples and expensive model fine-tuning. We
propose Reflexion, a novel framework to reinforce language agents not by
updating weights, but instead through linguistic feedback. Concretely,
Reflexion agents verbally reflect on task feedback signals, then maintain their
own reflective text in an episodic memory buffer to induce better
decision-making in subsequent trials. Reflexion is flexible enough to
incorporate various types (scalar values or free-form language) and sources
(external or internally simulated) of feedback signals, and obtains significant
improvements over a baseline agent across diverse tasks (sequential
decision-making, coding, language reasoning). For example, Reflexion achieves a
91% pass@1 accuracy on the HumanEval coding benchmark, surpassing the previous
state-of-the-art GPT-4 that achieves 80%. We also conduct ablation and analysis
studies using different feedback signals, feedback incorporation methods, and
agent types, and provide insights into how they affect performance.",Noah Shinn and Federico Cassano and Ashwin Gopinath and Karthik R Narasimhan and Shunyu Yao,2023,,https://openreview.net/forum?id=vAElhFcKW6,,
LLM-based Multi-Agent Blackboard System for Information Discovery in Data Science,http://arxiv.org/abs/2510.01285v1,10.5555/3495724.3496517,\cite{10.5555/3495724.3496517},Retrieval-augmented generation for knowledge-intensive NLP tasks,,,"Lewis, Patrick and Perez, Ethan and Piktus, Aleksandra and Petroni, Fabio and Karpukhin, Vladimir and Goyal, Naman and K\""{u}ttler, Heinrich and Lewis, Mike and Yih, Wen-tau and Rockt\""{a}schel, Tim and Riedel, Sebastian and Kiela, Douwe",2020,,,,
LLM-based Multi-Agent Blackboard System for Information Discovery in Data Science,http://arxiv.org/abs/2510.01285v1,salemi2025planandrefinediversecomprehensiveretrievalaugmented,\cite{salemi2025planandrefinediversecomprehensiveretrievalaugmented},Plan-and-Refine: Diverse and Comprehensive Retrieval-Augmented Generation,,,Alireza Salemi and Chris Samarinas and Hamed Zamani,2025,,https://arxiv.org/abs/2504.07794,,
LLM-based Multi-Agent Blackboard System for Information Discovery in Data Science,http://arxiv.org/abs/2510.01285v1,10.1145/3731120.3744584,\cite{10.1145/3731120.3744584},"Learning to Rank for Multiple Retrieval-Augmented Models through
  Iterative Utility Maximization",http://arxiv.org/abs/2410.09942v2,"This paper investigates the design of a unified search engine to serve
multiple retrieval-augmented generation (RAG) agents, each with a distinct
task, backbone large language model (LLM), and RAG strategy. We introduce an
iterative approach where the search engine generates retrieval results for the
RAG agents and gathers feedback on the quality of the retrieved documents
during an offline phase. This feedback is then used to iteratively optimize the
search engine using an expectation-maximization algorithm, with the goal of
maximizing each agent's utility function. Additionally, we adapt this to an
online setting, allowing the search engine to refine its behavior based on
real-time individual agents feedback to better serve the results for each of
them. Experiments on datasets from the Knowledge-Intensive Language Tasks
(KILT) benchmark demonstrates that our approach significantly on average
outperforms baselines across 18 RAG models. We demonstrate that our method
effectively ``personalizes'' the retrieval for each RAG agent based on the
collected feedback. Finally, we provide a comprehensive ablation study to
explore various aspects of our method.","Salemi, Alireza and Zamani, Hamed",2025,,https://doi.org/10.1145/3731120.3744584,10.1145/3731120.3744584,
LLM-based Multi-Agent Blackboard System for Information Discovery in Data Science,http://arxiv.org/abs/2510.01285v1,10.1145/3626772.3657733,\cite{10.1145/3626772.3657733},"Towards a Search Engine for Machines: Unified Ranking for Multiple
  Retrieval-Augmented Large Language Models",http://arxiv.org/abs/2405.00175v1,"This paper introduces uRAG--a framework with a unified retrieval engine that
serves multiple downstream retrieval-augmented generation (RAG) systems. Each
RAG system consumes the retrieval results for a unique purpose, such as
open-domain question answering, fact verification, entity linking, and relation
extraction. We introduce a generic training guideline that standardizes the
communication between the search engine and the downstream RAG systems that
engage in optimizing the retrieval model. This lays the groundwork for us to
build a large-scale experimentation ecosystem consisting of 18 RAG systems that
engage in training and 18 unknown RAG systems that use the uRAG as the new
users of the search engine. Using this experimentation ecosystem, we answer a
number of fundamental research questions that improve our understanding of
promises and challenges in developing search engines for machines.","Salemi, Alireza and Zamani, Hamed",2024,,https://doi.org/10.1145/3626772.3657733,10.1145/3626772.3657733,
LLM-based Multi-Agent Blackboard System for Information Discovery in Data Science,http://arxiv.org/abs/2510.01285v1,li2025autokaggle,\cite{li2025autokaggle},"AutoKaggle: A Multi-Agent Framework for Autonomous Data Science
  Competitions",http://arxiv.org/abs/2410.20424v3,"Data science tasks involving tabular data present complex challenges that
require sophisticated problem-solving approaches. We propose AutoKaggle, a
powerful and user-centric framework that assists data scientists in completing
daily data pipelines through a collaborative multi-agent system. AutoKaggle
implements an iterative development process that combines code execution,
debugging, and comprehensive unit testing to ensure code correctness and logic
consistency. The framework offers highly customizable workflows, allowing users
to intervene at each phase, thus integrating automated intelligence with human
expertise. Our universal data science toolkit, comprising validated functions
for data cleaning, feature engineering, and modeling, forms the foundation of
this solution, enhancing productivity by streamlining common tasks. We selected
8 Kaggle competitions to simulate data processing workflows in real-world
application scenarios. Evaluation results demonstrate that AutoKaggle achieves
a validation submission rate of 0.85 and a comprehensive score of 0.82 in
typical data science pipelines, fully proving its effectiveness and
practicality in handling complex data science tasks.",Ziming Li and Qianbo Zang and David Ma and Jiawei Guo and Tuney Zheng and Minghao Liu and Xinyao Niu and Yue Wang and Jian Yang and Jiaheng Liu and Wanjun Zhong and Wangchunshu Zhou and Wenhao Huang and Ge Zhang,2024,,https://arxiv.org/abs/2410.20424,,
LLM-based Multi-Agent Blackboard System for Information Discovery in Data Science,http://arxiv.org/abs/2510.01285v1,10.1145/356810.356816,\cite{10.1145/356810.356816},The Hearsay-II Speech-Understanding System: Integrating Knowledge to Resolve Uncertainty,,,"Erman, Lee D. and Hayes-Roth, Frederick and Lesser, Victor R. and Reddy, D. Raj",1980,,https://doi.org/10.1145/356810.356816,10.1145/356810.356816,ACM Comput. Surv.
LLM-based Multi-Agent Blackboard System for Information Discovery in Data Science,http://arxiv.org/abs/2510.01285v1,Nii_1986,\cite{Nii_1986},The Blackboard Model of Problem Solving and the Evolution of Blackboard Architectures,,,"Nii, H. Penny",1986,Jun.,https://ojs.aaai.org/aimagazine/index.php/aimagazine/article/view/537,10.1609/aimag.v7i2.537,AI Magazine
LLM-based Multi-Agent Blackboard System for Information Discovery in Data Science,http://arxiv.org/abs/2510.01285v1,Nii_Feigenbaum_Anton_1982,\cite{Nii_Feigenbaum_Anton_1982},Signal-to-Symbol Transformation: HASP/SIAP Case Study,,,"Nii, H. Penny and Feigenbaum, Edward A. and Anton, John J.",1982,Jun.,https://ojs.aaai.org/aimagazine/index.php/aimagazine/article/view/368,10.1609/aimag.v3i2.368,AI Magazine
