parent_paper_title,parent_arxiv_link,citation_shorthand,raw_citation_text,cited_paper_title,cited_paper_arxiv_link,cited_paper_abstract,bib_paper_authors,bib_paper_year,bib_paper_month,bib_paper_url,bib_paper_doi,bib_paper_journal
MASC: Boosting Autoregressive Image Generation with a Manifold-Aligned Semantic Clustering,http://arxiv.org/abs/2510.04220v1,huh2023straightening,\cite{huh2023straightening},"Straightening Out the Straight-Through Estimator: Overcoming
  Optimization Challenges in Vector Quantized Networks",http://arxiv.org/abs/2305.08842v1,"This work examines the challenges of training neural networks using vector
quantization using straight-through estimation. We find that a primary cause of
training instability is the discrepancy between the model embedding and the
code-vector distribution. We identify the factors that contribute to this
issue, including the codebook gradient sparsity and the asymmetric nature of
the commitment loss, which leads to misaligned code-vector assignments. We
propose to address this issue via affine re-parameterization of the code
vectors. Additionally, we introduce an alternating optimization to reduce the
gradient error introduced by the straight-through estimation. Moreover, we
propose an improvement to the commitment loss to ensure better alignment
between the codebook representation and the model embedding. These optimization
methods improve the mathematical approximation of the straight-through
estimation and, ultimately, the model performance. We demonstrate the
effectiveness of our methods on several common model architectures, such as
AlexNet, ResNet, and ViT, across various tasks, including image classification
and generative modeling.","Huh, Minyoung and Cheung, Brian and Agrawal, Pulkit and Isola, Phillip",2023,,,,
MASC: Boosting Autoregressive Image Generation with a Manifold-Aligned Semantic Clustering,http://arxiv.org/abs/2510.04220v1,tang2025exploitingdiscriminativecodebookprior,\cite{tang2025exploitingdiscriminativecodebookprior},"Exploiting Discriminative Codebook Prior for Autoregressive Image
  Generation",http://arxiv.org/abs/2508.10719v1,"Advanced discrete token-based autoregressive image generation systems first
tokenize images into sequences of token indices with a codebook, and then model
these sequences in an autoregressive paradigm. While autoregressive generative
models are trained only on index values, the prior encoded in the codebook,
which contains rich token similarity information, is not exploited. Recent
studies have attempted to incorporate this prior by performing naive k-means
clustering on the tokens, helping to facilitate the training of generative
models with a reduced codebook. However, we reveal that k-means clustering
performs poorly in the codebook feature space due to inherent issues, including
token space disparity and centroid distance inaccuracy. In this work, we
propose the Discriminative Codebook Prior Extractor (DCPE) as an alternative to
k-means clustering for more effectively mining and utilizing the token
similarity information embedded in the codebook. DCPE replaces the commonly
used centroid-based distance, which is found to be unsuitable and inaccurate
for the token feature space, with a more reasonable instance-based distance.
Using an agglomerative merging technique, it further addresses the token space
disparity issue by avoiding splitting high-density regions and aggregating
low-density ones. Extensive experiments demonstrate that DCPE is plug-and-play
and integrates seamlessly with existing codebook prior-based paradigms. With
the discriminative prior extracted, DCPE accelerates the training of
autoregressive models by 42% on LlamaGen-B and improves final FID and IS
performance.",Longxiang Tang and Ruihang Chu and Xiang Wang and Yujin Han and Pingyu Wu and Chunming He and Yingya Zhang and Shiwei Zhang and Jiaya Jia,2025,,https://arxiv.org/abs/2508.10719,,
MASC: Boosting Autoregressive Image Generation with a Manifold-Aligned Semantic Clustering,http://arxiv.org/abs/2510.04220v1,beyer1999nearest,\cite{beyer1999nearest},When is “nearest neighbor” meaningful?,,,"Beyer, Kevin and Goldstein, Jonathan and Ramakrishnan, Raghu and Shaft, Uri",1999,,,,
MASC: Boosting Autoregressive Image Generation with a Manifold-Aligned Semantic Clustering,http://arxiv.org/abs/2510.04220v1,li2023resizing,\cite{li2023resizing},Resizing codebook of vector quantization without retraining,,,"Li, Lei and Liu, Tingting and Wang, Chengyu and Qiu, Minghui and Chen, Cen and Gao, Ming and Zhou, Aoying",2023,,,,Multimedia Systems
MASC: Boosting Autoregressive Image Generation with a Manifold-Aligned Semantic Clustering,http://arxiv.org/abs/2510.04220v1,zheng2023online,\cite{zheng2023online},Online Clustered Codebook,http://arxiv.org/abs/2307.15139v1,"Vector Quantisation (VQ) is experiencing a comeback in machine learning,
where it is increasingly used in representation learning. However, optimizing
the codevectors in existing VQ-VAE is not entirely trivial. A problem is
codebook collapse, where only a small subset of codevectors receive gradients
useful for their optimisation, whereas a majority of them simply ``dies off''
and is never updated or used. This limits the effectiveness of VQ for learning
larger codebooks in complex computer vision tasks that require high-capacity
representations. In this paper, we present a simple alternative method for
online codebook learning, Clustering VQ-VAE (CVQ-VAE). Our approach selects
encoded features as anchors to update the ``dead'' codevectors, while
optimising the codebooks which are alive via the original loss. This strategy
brings unused codevectors closer in distribution to the encoded features,
increasing the likelihood of being chosen and optimized. We extensively
validate the generalization capability of our quantiser on various datasets,
tasks (e.g. reconstruction and generation), and architectures (e.g. VQ-VAE,
VQGAN, LDM). Our CVQ-VAE can be easily integrated into the existing models with
just a few lines of code.","Zheng, Chuanxia and Vedaldi, Andrea",2023,,,,
MASC: Boosting Autoregressive Image Generation with a Manifold-Aligned Semantic Clustering,http://arxiv.org/abs/2510.04220v1,tenenbaum2000global,\cite{tenenbaum2000global},A global geometric framework for nonlinear dimensionality reduction,,,"Tenenbaum, Joshua B and De Silva, Vin and Langford, John C",2000,,,,Science
MASC: Boosting Autoregressive Image Generation with a Manifold-Aligned Semantic Clustering,http://arxiv.org/abs/2510.04220v1,belkin2003laplacian,\cite{belkin2003laplacian},Laplacian eigenmaps for dimensionality reduction and data representation,,,"Belkin, Mikhail and Niyogi, Partha",2003,,,,Neural computation
MASC: Boosting Autoregressive Image Generation with a Manifold-Aligned Semantic Clustering,http://arxiv.org/abs/2510.04220v1,angiulli2018behavior,\cite{angiulli2018behavior},"On the behavior of intrinsically high-dimensional spaces: distances, direct and reverse nearest neighbors, and hubness",,,"Angiulli, Fabrizio",2018,,,,Journal of Machine Learning Research
MASC: Boosting Autoregressive Image Generation with a Manifold-Aligned Semantic Clustering,http://arxiv.org/abs/2510.04220v1,chen2024revisiting,\cite{chen2024revisiting},Revisiting the Manifold Hypothesis in Deep Representational Learning,,,"Chen, Wei and Li, Xiang",2024,,,,
MASC: Boosting Autoregressive Image Generation with a Manifold-Aligned Semantic Clustering,http://arxiv.org/abs/2510.04220v1,lukasova1979hierarchical,\cite{lukasova1979hierarchical},Hierarchical agglomerative clustering procedure,,,"Lukasov{\'a}, Alena",1979,,,,Pattern Recognition
MASC: Boosting Autoregressive Image Generation with a Manifold-Aligned Semantic Clustering,http://arxiv.org/abs/2510.04220v1,ward1963hierarchical,\cite{ward1963hierarchical},Hierarchical grouping to optimize an objective function,,,"Ward Jr, Joe H",1963,,,,Journal of the American statistical association
