parent_paper_title,parent_arxiv_link,citation_shorthand,raw_citation_text,cited_paper_title,cited_paper_arxiv_link,cited_paper_abstract,bib_paper_authors,bib_paper_year,bib_paper_month,bib_paper_url,bib_paper_doi,bib_paper_journal
Beyond Pairwise Connections: Extracting High-Order Functional Brain Network Structures under Global Constraints,http://arxiv.org/abs/2510.09175v1,xu2024contrastive,\cite{xu2024contrastive},"Contrastive Graph Pooling for Explainable Classification of Brain
  Networks",http://arxiv.org/abs/2307.11133v3,"Functional magnetic resonance imaging (fMRI) is a commonly used technique to
measure neural activation. Its application has been particularly important in
identifying underlying neurodegenerative conditions such as Parkinson's,
Alzheimer's, and Autism. Recent analysis of fMRI data models the brain as a
graph and extracts features by graph neural networks (GNNs). However, the
unique characteristics of fMRI data require a special design of GNN. Tailoring
GNN to generate effective and domain-explainable features remains challenging.
In this paper, we propose a contrastive dual-attention block and a
differentiable graph pooling method called ContrastPool to better utilize GNN
for brain networks, meeting fMRI-specific requirements. We apply our method to
5 resting-state fMRI brain network datasets of 3 diseases and demonstrate its
superiority over state-of-the-art baselines. Our case study confirms that the
patterns extracted by our method match the domain knowledge in neuroscience
literature, and disclose direct and interesting insights. Our contributions
underscore the potential of ContrastPool for advancing the understanding of
brain networks and neurodegenerative conditions. The source code is available
at https://github.com/AngusMonroe/ContrastPool.","Xu, Jiaxing and Bian, Qingtian and Li, Xinhang and Zhang, Aihu and Ke, Yiping and Qiao, Miao and Zhang, Wei and Sim, Wei Khang Jeremy and Guly{\'a}s, Bal{\'a}zs",2024,,,,IEEE Trans. Med. Imaging.
Beyond Pairwise Connections: Extracting High-Order Functional Brain Network Structures under Global Constraints,http://arxiv.org/abs/2510.09175v1,hu2021gat,\cite{hu2021gat},GAT-LI: a graph attention network based learning and interpreting method for functional brain network classification,,,"Hu, Jinlong and Cao, Lijie and Li, Tenghui and Dong, Shoubin and Li, Ping",2021,,,,BMC bioinformatics
Beyond Pairwise Connections: Extracting High-Order Functional Brain Network Structures under Global Constraints,http://arxiv.org/abs/2510.09175v1,kim2021learning,\cite{kim2021learning},"Learning Dynamic Graph Representation of Brain Connectome with
  Spatio-Temporal Attention",http://arxiv.org/abs/2105.13495v2,"Functional connectivity (FC) between regions of the brain can be assessed by
the degree of temporal correlation measured with functional neuroimaging
modalities. Based on the fact that these connectivities build a network,
graph-based approaches for analyzing the brain connectome have provided
insights into the functions of the human brain. The development of graph neural
networks (GNNs) capable of learning representation from graph structured data
has led to increased interest in learning the graph representation of the brain
connectome. Although recent attempts to apply GNN to the FC network have shown
promising results, there is still a common limitation that they usually do not
incorporate the dynamic characteristics of the FC network which fluctuates over
time. In addition, a few studies that have attempted to use dynamic FC as an
input for the GNN reported a reduction in performance compared to static FC
methods, and did not provide temporal explainability. Here, we propose STAGIN,
a method for learning dynamic graph representation of the brain connectome with
spatio-temporal attention. Specifically, a temporal sequence of brain graphs is
input to the STAGIN to obtain the dynamic graph representation, while novel
READOUT functions and the Transformer encoder provide spatial and temporal
explainability with attention, respectively. Experiments on the HCP-Rest and
the HCP-Task datasets demonstrate exceptional performance of our proposed
method. Analysis of the spatio-temporal attention also provide concurrent
interpretation with the neuroscientific knowledge, which further validates our
method. Code is available at https://github.com/egyptdj/stagin","Kim, Byung-Hoon and Ye, Jong Chul and Kim, Jae-Jin",2021,,,,Advances in Neural Information Processing Systems
Beyond Pairwise Connections: Extracting High-Order Functional Brain Network Structures under Global Constraints,http://arxiv.org/abs/2510.09175v1,ijcai2019p669,\cite{ijcai2019p669},Adversarial Examples for Graph Data: Deep Insights into Attack and Defense,,,"Wu, Huijun and Wang, Chen and Tyshetskiy, Yuriy and Docherty, Andrew and Lu, Kai and Zhu, Liming",2019,7,,,
Beyond Pairwise Connections: Extracting High-Order Functional Brain Network Structures under Global Constraints,http://arxiv.org/abs/2510.09175v1,yuan2025dg,\cite{yuan2025dg},DG-Mamba: Robust and Efficient Dynamic Graph Structure Learning with Selective State Space Models,,,"Yuan, Haonan and Sun, Qingyun and Wang, Zhaonan and Fu, Xingcheng and Ji, Cheng and Wang, Yongjian and Jin, Bo and Li, Jianxin",2025,,,,
Beyond Pairwise Connections: Extracting High-Order Functional Brain Network Structures under Global Constraints,http://arxiv.org/abs/2510.09175v1,ijcai2022reg,\cite{ijcai2022reg},"Regularized Graph Structure Learning with Semantic Knowledge for
  Multi-variates Time-Series Forecasting",http://arxiv.org/abs/2210.06126v1,"Multivariate time-series forecasting is a critical task for many
applications, and graph time-series network is widely studied due to its
capability to capture the spatial-temporal correlation simultaneously. However,
most existing works focus more on learning with the explicit prior graph
structure, while ignoring potential information from the implicit graph
structure, yielding incomplete structure modeling. Some recent works attempt to
learn the intrinsic or implicit graph structure directly while lacking a way to
combine explicit prior structure with implicit structure together. In this
paper, we propose Regularized Graph Structure Learning (RGSL) model to
incorporate both explicit prior structure and implicit structure together, and
learn the forecasting deep networks along with the graph structure. RGSL
consists of two innovative modules. First, we derive an implicit dense
similarity matrix through node embedding, and learn the sparse graph structure
using the Regularized Graph Generation (RGG) based on the Gumbel Softmax trick.
Second, we propose a Laplacian Matrix Mixed-up Module (LM3) to fuse the
explicit graph and implicit graph together. We conduct experiments on three
real-word datasets. Results show that the proposed RGSL model outperforms
existing graph forecasting algorithms with a notable margin, while learning
meaningful graph structure simultaneously. Our code and models are made
publicly available at https://github.com/alipay/RGSL.git.","Yu, Hongyuan and Li, Ting and Yu, Weichen and Li, Jianguo and Huang, Yan and Wang, Liang and Liu, Alex",2022,7,,,
Beyond Pairwise Connections: Extracting High-Order Functional Brain Network Structures under Global Constraints,http://arxiv.org/abs/2510.09175v1,wu2022nodeformer,\cite{wu2022nodeformer},"NodeFormer: A Scalable Graph Structure Learning Transformer for Node
  Classification",http://arxiv.org/abs/2306.08385v1,"Graph neural networks have been extensively studied for learning with
inter-connected data. Despite this, recent evidence has revealed GNNs'
deficiencies related to over-squashing, heterophily, handling long-range
dependencies, edge incompleteness and particularly, the absence of graphs
altogether. While a plausible solution is to learn new adaptive topology for
message passing, issues concerning quadratic complexity hinder simultaneous
guarantees for scalability and precision in large networks. In this paper, we
introduce a novel all-pair message passing scheme for efficiently propagating
node signals between arbitrary nodes, as an important building block for a
pioneering Transformer-style network for node classification on large graphs,
dubbed as \textsc{NodeFormer}. Specifically, the efficient computation is
enabled by a kernerlized Gumbel-Softmax operator that reduces the algorithmic
complexity to linearity w.r.t. node numbers for learning latent graph
structures from large, potentially fully-connected graphs in a differentiable
manner. We also provide accompanying theory as justification for our design.
Extensive experiments demonstrate the promising efficacy of the method in
various tasks including node classification on graphs (with up to 2M nodes) and
graph-enhanced applications (e.g., image classification) where input graphs are
missing.",Qitian Wu and Wentao Zhao and Zenan Li and David Wipf and Junchi Yan,2022,,,,
Beyond Pairwise Connections: Extracting High-Order Functional Brain Network Structures under Global Constraints,http://arxiv.org/abs/2510.09175v1,ghiasi2025enhancing,\cite{ghiasi2025enhancing},Enhancing graph structure learning through multiple features and graphs fusion,,,"Ghiasi, Razieh and Bosaghzadeh, Alireza and Amirkhani, Hossein",2025,,,,Computers and Electrical Engineering
Beyond Pairwise Connections: Extracting High-Order Functional Brain Network Structures under Global Constraints,http://arxiv.org/abs/2510.09175v1,zheng2024mulan,\cite{zheng2024mulan},MULAN: multi-modal causal structure learning and root cause analysis for microservice systems,,,"Zheng, Lecheng and Chen, Zhengzhang and He, Jingrui and Chen, Haifeng",2024,,,,
Beyond Pairwise Connections: Extracting High-Order Functional Brain Network Structures under Global Constraints,http://arxiv.org/abs/2510.09175v1,ng2024structure,\cite{ng2024structure},Structure learning with continuous optimization: A sober look and beyond,,,"Ng, Ignavier and Huang, Biwei and Zhang, Kun",2024,,,,
Beyond Pairwise Connections: Extracting High-Order Functional Brain Network Structures under Global Constraints,http://arxiv.org/abs/2510.09175v1,qiu2024refining,\cite{qiu2024refining},"Refining Latent Homophilic Structures over Heterophilic Graphs for
  Robust Graph Convolution Networks",http://arxiv.org/abs/2312.16418v1,"Graph convolution networks (GCNs) are extensively utilized in various graph
tasks to mine knowledge from spatial data. Our study marks the pioneering
attempt to quantitatively investigate the GCN robustness over omnipresent
heterophilic graphs for node classification. We uncover that the predominant
vulnerability is caused by the structural out-of-distribution (OOD) issue. This
finding motivates us to present a novel method that aims to harden GCNs by
automatically learning Latent Homophilic Structures over heterophilic graphs.
We term such a methodology as LHS. To elaborate, our initial step involves
learning a latent structure by employing a novel self-expressive technique
based on multi-node interactions. Subsequently, the structure is refined using
a pairwisely constrained dual-view contrastive learning approach. We
iteratively perform the above procedure, enabling a GCN model to aggregate
information in a homophilic way on heterophilic graphs. Armed with such an
adaptable structure, we can properly mitigate the structural OOD threats over
heterophilic graphs. Experiments on various benchmarks show the effectiveness
of the proposed LHS approach for robust GCNs.","Qiu, Chenyang and Nan, Guoshun and Xiong, Tianyu and Deng, Wendi and Wang, Di and Teng, Zhiyang and Sun, Lijuan and Cui, Qimei and Tao, Xiaofeng",2024,,,,
Beyond Pairwise Connections: Extracting High-Order Functional Brain Network Structures under Global Constraints,http://arxiv.org/abs/2510.09175v1,xie2025robust,\cite{xie2025robust},Robust Graph Structure Learning under Heterophily,http://arxiv.org/abs/2403.03659v1,"Graph is a fundamental mathematical structure in characterizing relations
between different objects and has been widely used on various learning tasks.
Most methods implicitly assume a given graph to be accurate and complete.
However, real data is inevitably noisy and sparse, which will lead to inferior
results. Despite the remarkable success of recent graph representation learning
methods, they inherently presume that the graph is homophilic, and largely
overlook heterophily, where most connected nodes are from different classes. In
this regard, we propose a novel robust graph structure learning method to
achieve a high-quality graph from heterophilic data for downstream tasks. We
first apply a high-pass filter to make each node more distinctive from its
neighbors by encoding structure information into the node features. Then, we
learn a robust graph with an adaptive norm characterizing different levels of
noise. Afterwards, we propose a novel regularizer to further refine the graph
structure. Clustering and semi-supervised classification experiments on
heterophilic graphs verify the effectiveness of our method.","Xie, Xuanting and Chen, Wenyu and Kang, Zhao",2025,,,,Neural Networks
Beyond Pairwise Connections: Extracting High-Order Functional Brain Network Structures under Global Constraints,http://arxiv.org/abs/2510.09175v1,li2024gslb,\cite{li2024gslb},GSLB: The Graph Structure Learning Benchmark,http://arxiv.org/abs/2310.05174v1,"Graph Structure Learning (GSL) has recently garnered considerable attention
due to its ability to optimize both the parameters of Graph Neural Networks
(GNNs) and the computation graph structure simultaneously. Despite the
proliferation of GSL methods developed in recent years, there is no standard
experimental setting or fair comparison for performance evaluation, which
creates a great obstacle to understanding the progress in this field. To fill
this gap, we systematically analyze the performance of GSL in different
scenarios and develop a comprehensive Graph Structure Learning Benchmark (GSLB)
curated from 20 diverse graph datasets and 16 distinct GSL algorithms.
Specifically, GSLB systematically investigates the characteristics of GSL in
terms of three dimensions: effectiveness, robustness, and complexity. We
comprehensively evaluate state-of-the-art GSL algorithms in node- and
graph-level tasks, and analyze their performance in robust learning and model
complexity. Further, to facilitate reproducible research, we have developed an
easy-to-use library for training, evaluating, and visualizing different GSL
methods. Empirical results of our extensive experiments demonstrate the ability
of GSL and reveal its potential benefits on various downstream tasks, offering
insights and opportunities for future research. The code of GSLB is available
at: https://github.com/GSL-Benchmark/GSLB.","Li, Zhixun and Sun, Xin and Luo, Yifan and Zhu, Yanqiao and Chen, Dingshuo and Luo, Yingtao and Zhou, Xiangxin and Liu, Qiang and Wu, Shu and Wang, Liang and others",2024,,,,Adv. Neural Inf. Process. Syst.
Beyond Pairwise Connections: Extracting High-Order Functional Brain Network Structures under Global Constraints,http://arxiv.org/abs/2510.09175v1,sun2022graph,\cite{sun2022graph},Graph structure learning with variational information bottleneck,,,"Sun, Qingyun and Li, Jianxin and Peng, Hao and Wu, Jia and Fu, Xingcheng and Ji, Cheng and Philip, S Yu",2022,,,,
Beyond Pairwise Connections: Extracting High-Order Functional Brain Network Structures under Global Constraints,http://arxiv.org/abs/2510.09175v1,zhang2019hierarchical,\cite{zhang2019hierarchical},Hierarchical Multi-View Graph Pooling With Structure Learning,,,"Zhen Zhang and
                  Jiajun Bu and
                  Martin Ester and
                  Jianfeng Zhang and
                  Zhao Li and
                  Chengwei Yao and
                  Huifen Dai and
                  Zhi Yu and
                  Can Wang",2023,,,,Comput. Biol. Med.
Beyond Pairwise Connections: Extracting High-Order Functional Brain Network Structures under Global Constraints,http://arxiv.org/abs/2510.09175v1,zong2024new,\cite{zong2024new},"A New Brain Network Construction Paradigm for Brain Disorder via
  Diffusion-based Graph Contrastive Learning",http://arxiv.org/abs/2407.18329v1,"Brain network analysis plays an increasingly important role in studying brain
function and the exploring of disease mechanisms. However, existing brain
network construction tools have some limitations, including dependency on
empirical users, weak consistency in repeated experiments and time-consuming
processes. In this work, a diffusion-based brain network pipeline, DGCL is
designed for end-to-end construction of brain networks. Initially, the brain
region-aware module (BRAM) precisely determines the spatial locations of brain
regions by the diffusion process, avoiding subjective parameter selection.
Subsequently, DGCL employs graph contrastive learning to optimize brain
connections by eliminating individual differences in redundant connections
unrelated to diseases, thereby enhancing the consistency of brain networks
within the same group. Finally, the node-graph contrastive loss and
classification loss jointly constrain the learning process of the model to
obtain the reconstructed brain network, which is then used to analyze important
brain connections. Validation on two datasets, ADNI and ABIDE, demonstrates
that DGCL surpasses traditional methods and other deep learning models in
predicting disease development stages. Significantly, the proposed model
improves the efficiency and generalization of brain network construction. In
summary, the proposed DGCL can be served as a universal brain network
construction scheme, which can effectively identify important brain connections
through generative paradigms and has the potential to provide disease
interpretability support for neuroscience research.","Zong, Yongcheng and Zuo, Qiankun and Ng, Michael Kwok-Po and Lei, Baiying and Wang, Shuqiang",2024,,,,IEEE Trans. Pattern. Anal. Mach. Intell.
