parent_paper_title,parent_arxiv_link,citation_shorthand,raw_citation_text,cited_paper_title,cited_paper_arxiv_link,cited_paper_abstract,bib_paper_authors,bib_paper_year,bib_paper_month,bib_paper_url,bib_paper_doi,bib_paper_journal
CalibCLIP: Contextual Calibration of Dominant Semantics for Text-Driven Image Retrieval,http://arxiv.org/abs/2510.05586v1,tcsvt_2023_CTLG,\cite{tcsvt_2023_CTLG},"Contrastive Transformer Learning with Proximity Data Generation for
  Text-Based Person Search",http://arxiv.org/abs/2311.09084v1,"Given a descriptive text query, text-based person search (TBPS) aims to
retrieve the best-matched target person from an image gallery. Such a
cross-modal retrieval task is quite challenging due to significant modality
gap, fine-grained differences and insufficiency of annotated data. To better
align the two modalities, most existing works focus on introducing
sophisticated network structures and auxiliary tasks, which are complex and
hard to implement. In this paper, we propose a simple yet effective dual
Transformer model for text-based person search. By exploiting a hardness-aware
contrastive learning strategy, our model achieves state-of-the-art performance
without any special design for local feature alignment or side information.
Moreover, we propose a proximity data generation (PDG) module to automatically
produce more diverse data for cross-modal training. The PDG module first
introduces an automatic generation algorithm based on a text-to-image diffusion
model, which generates new text-image pair samples in the proximity space of
original ones. Then it combines approximate text generation and feature-level
mixup during training to further strengthen the data diversity. The PDG module
can largely guarantee the reasonability of the generated samples that are
directly used for training without any human inspection for noise rejection. It
improves the performance of our model significantly, providing a feasible
solution to the data insufficiency problem faced by such fine-grained
visual-linguistic tasks. Extensive experiments on two popular datasets of the
TBPS task (i.e., CUHK-PEDES and ICFG-PEDES) show that the proposed approach
outperforms state-of-the-art approaches evidently, e.g., improving by 3.88%,
4.02%, 2.92% in terms of Top1, Top5, Top10 on CUHK-PEDES. The codes will be
available at https://github.com/HCPLab-SYSU/PersonSearch-CTLG","Wu, Hefeng and Chen, Weifeng and Liu, Zhibin and Chen, Tianshui and Chen, Zhiguang and Lin, Liang",2024,,,,IEEE Transactions on Circuits and Systems for Video Technology
CalibCLIP: Contextual Calibration of Dominant Semantics for Text-Driven Image Retrieval,http://arxiv.org/abs/2510.05586v1,tnnls_2024_EAIB,\cite{tnnls_2024_EAIB},Improving Text-Based Person Retrieval by Excavating All-Round Information Beyond Color,,,"Zhu, Aichun and Wang, Zijie and Xue, Jingyi and Wan, Xili and Jin, Jing and Wang, Tian and Snoussi, Hichem",2025,,,,IEEE Transactions on Neural Networks and Learning Systems
CalibCLIP: Contextual Calibration of Dominant Semantics for Text-Driven Image Retrieval,http://arxiv.org/abs/2510.05586v1,Liu2024Causality,\cite{Liu2024Causality},Causality-Inspired Invariant Representation Learning for Text-Based Person Retrieval,,,Yifan Liu and Guoliang Qin and Hao Chen and Zhaoyang Zeng and Xiatian Yang,2024,,,,
CalibCLIP: Contextual Calibration of Dominant Semantics for Text-Driven Image Retrieval,http://arxiv.org/abs/2510.05586v1,Pan_2023_CVPR,\cite{Pan_2023_CVPR},Fine-Grained Image-Text Matching by Cross-Modal Hard Aligning Network,,,"Pan, Zhengxin and Wu, Fangyu and Zhang, Bailing",2023,June,,,
CalibCLIP: Contextual Calibration of Dominant Semantics for Text-Driven Image Retrieval,http://arxiv.org/abs/2510.05586v1,2024_SIGIR_ACM,\cite{2024_SIGIR_ACM},"CaLa: Complementary Association Learning for Augmenting Composed Image
  Retrieval",http://arxiv.org/abs/2405.19149v2,"Composed Image Retrieval (CIR) involves searching for target images based on
an image-text pair query. While current methods treat this as a query-target
matching problem, we argue that CIR triplets contain additional associations
beyond this primary relation. In our paper, we identify two new relations
within triplets, treating each triplet as a graph node. Firstly, we introduce
the concept of text-bridged image alignment, where the query text serves as a
bridge between the query image and the target image. We propose a hinge-based
cross-attention mechanism to incorporate this relation into network learning.
Secondly, we explore complementary text reasoning, considering CIR as a form of
cross-modal retrieval where two images compose to reason about complementary
text. To integrate these perspectives effectively, we design a twin
attention-based compositor. By combining these complementary associations with
the explicit query pair-target image relation, we establish a comprehensive set
of constraints for CIR. Our framework, CaLa (Complementary Association Learning
for Augmenting Composed Image Retrieval), leverages these insights. We evaluate
CaLa on CIRR and FashionIQ benchmarks with multiple backbones, demonstrating
its superiority in composed image retrieval.","Jiang, Xintong and Wang, Yaxiong and Li, Mengjian and Wu, Yujiao and Hu, Bingwen and Qian, Xueming",2024,,,,
